,Title,Year,Rated,Released,Runtime,Genre,Director,Writer,Actors,Plot,Language,Country,Awards,Poster,Ratings,Metascore,imdbRating,imdbVotes,imdbID,Type,DVD,BoxOffice,Production,Website,Response,totalSeasons
0,Guardians of the Galaxy,2014,PG-13,01 Aug 2014,121 min,"Action, Adventure, Comedy",James Gunn,"James Gunn, Nicole Perlman, Dan Abnett","Chris Pratt, Vin Diesel, Bradley Cooper",A group of intergalactic criminals must pull together to stop a fanatical warrior with plans to purge the universe.,English,United States,Nominated for 2 Oscars. 52 wins & 102 nominations total,https://m.media-amazon.com/images/M/MV5BMTAwMjU5OTgxNjZeQTJeQWpwZ15BbWU4MDUxNDYxODEx._V1_SX300.jpg,"[{'Source': 'Internet Movie Database', 'Value': '8.0/10'}, {'Source': 'Rotten Tomatoes', 'Value': '92%'}, {'Source': 'Metacritic', 'Value': '76/100'}]",76,8.0,"1,119,031",tt2015381,movie,09 Dec 2014,"$333,718,600",N/A,N/A,True,
1,Interstellar,2014,PG-13,07 Nov 2014,169 min,"Adventure, Drama, Sci-Fi",Christopher Nolan,"Jonathan Nolan, Christopher Nolan","Matthew McConaughey, Anne Hathaway, Jessica Chastain",A team of explorers travel through a wormhole in space in an attempt to ensure humanity's survival.,English,"United States, United Kingdom, Canada",Won 1 Oscar. 44 wins & 148 nominations total,https://m.media-amazon.com/images/M/MV5BZjdkOTU3MDktN2IxOS00OGEyLWFmMjktY2FiMmZkNWIyODZiXkEyXkFqcGdeQXVyMTMxODk2OTU@._V1_SX300.jpg,"[{'Source': 'Internet Movie Database', 'Value': '8.6/10'}, {'Source': 'Rotten Tomatoes', 'Value': '72%'}, {'Source': 'Metacritic', 'Value': '74/100'}]",74,8.6,"1,676,203",tt0816692,movie,31 Mar 2015,"$188,020,017",N/A,N/A,True,
2,John Wick,2014,R,24 Oct 2014,101 min,"Action, Crime, Thriller","Chad Stahelski, David Leitch",Derek Kolstad,"Keanu Reeves, Michael Nyqvist, Alfie Allen",An ex-hit-man comes out of retirement to track down the gangsters that killed his dog and took everything from him.,"English, Russian, Hungarian","United States, United Kingdom, China",5 wins & 10 nominations,https://m.media-amazon.com/images/M/MV5BMTU2NjA1ODgzMF5BMl5BanBnXkFtZTgwMTM2MTI4MjE@._V1_SX300.jpg,"[{'Source': 'Internet Movie Database', 'Value': '7.4/10'}, {'Source': 'Rotten Tomatoes', 'Value': '86%'}, {'Source': 'Metacritic', 'Value': '68/100'}]",68,7.4,"593,624",tt2911666,movie,03 Feb 2015,"$43,037,835",N/A,N/A,True,
3,Edge of Tomorrow,2014,PG-13,06 Jun 2014,113 min,"Action, Adventure, Sci-Fi",Doug Liman,"Christopher McQuarrie, Jez Butterworth, John-Henry Butterworth","Tom Cruise, Emily Blunt, Bill Paxton","A soldier fighting aliens gets to relive the same day over and over again, the day restarting every time he dies.",English,"United States, Canada",11 wins & 38 nominations,https://m.media-amazon.com/images/M/MV5BMTc5OTk4MTM3M15BMl5BanBnXkFtZTgwODcxNjg3MDE@._V1_SX300.jpg,"[{'Source': 'Internet Movie Database', 'Value': '7.9/10'}, {'Source': 'Rotten Tomatoes', 'Value': '91%'}, {'Source': 'Metacritic', 'Value': '71/100'}]",71,7.9,"644,777",tt1631867,movie,07 Oct 2014,"$100,206,256",N/A,N/A,True,
4,Gone Girl,2014,R,03 Oct 2014,149 min,"Drama, Mystery, Thriller",David Fincher,Gillian Flynn,"Ben Affleck, Rosamund Pike, Neil Patrick Harris","With his wife's disappearance having become the focus of an intense media circus, a man sees the spotlight turned on him when it's suspected that he may not be innocent.",English,United States,Nominated for 1 Oscar. 64 wins & 188 nominations total,https://m.media-amazon.com/images/M/MV5BMTk0MDQ3MzAzOV5BMl5BanBnXkFtZTgwNzU1NzE3MjE@._V1_SX300.jpg,"[{'Source': 'Internet Movie Database', 'Value': '8.1/10'}, {'Source': 'Rotten Tomatoes', 'Value': '87%'}, {'Source': 'Metacritic', 'Value': '79/100'}]",79,8.1,"924,443",tt2267998,movie,13 Jan 2015,"$167,767,189",N/A,N/A,True,
5,Captain America: The Winter Soldier,2014,PG-13,04 Apr 2014,136 min,"Action, Adventure, Sci-Fi","Anthony Russo, Joe Russo","Christopher Markus, Stephen McFeely, Joe Simon","Chris Evans, Samuel L. Jackson, Scarlett Johansson","As Steve Rogers struggles to embrace his role in the modern world, he teams up with a fellow Avenger and S.H.I.E.L.D agent, Black Widow, to battle a new threat from history: an assassin known as the Winter Soldier.","English, French",United States,Nominated for 1 Oscar. 5 wins & 52 nominations total,https://m.media-amazon.com/images/M/MV5BMzA2NDkwODAwM15BMl5BanBnXkFtZTgwODk5MTgzMTE@._V1_SX300.jpg,"[{'Source': 'Internet Movie Database', 'Value': '7.7/10'}, {'Source': 'Rotten Tomatoes', 'Value': '90%'}, {'Source': 'Metacritic', 'Value': '70/100'}]",70,7.7,"799,028",tt1843866,movie,09 Sep 2014,"$259,766,572",N/A,N/A,True,
6,The Grand Budapest Hotel,2014,R,28 Mar 2014,99 min,"Adventure, Comedy, Crime",Wes Anderson,"Stefan Zweig, Wes Anderson, Hugo Guinness","Ralph Fiennes, F. Murray Abraham, Mathieu Amalric","A writer encounters the owner of an aging high-class hotel, who tells him of his early years serving as a lobby boy in the hotel's glorious years under an exceptional concierge.","English, French, German","United States, Germany",Won 4 Oscars. 134 wins & 226 nominations total,https://m.media-amazon.com/images/M/MV5BMzM5NjUxOTEyMl5BMl5BanBnXkFtZTgwNjEyMDM0MDE@._V1_SX300.jpg,"[{'Source': 'Internet Movie Database', 'Value': '8.1/10'}, {'Source': 'Rotten Tomatoes', 'Value': '92%'}, {'Source': 'Metacritic', 'Value': '88/100'}]",88,8.1,"759,503",tt2278388,movie,17 Jun 2014,"$59,301,324",N/A,N/A,True,
7,Whiplash,2014,R,15 Oct 2014,106 min,"Drama, Music",Damien Chazelle,Damien Chazelle,"Miles Teller, J.K. Simmons, Melissa Benoist",A promising young drummer enrolls at a cut-throat music conservatory where his dreams of greatness are mentored by an instructor who will stop at nothing to realize a student's potential.,English,United States,Won 3 Oscars. 98 wins & 145 nominations total,https://m.media-amazon.com/images/M/MV5BOTA5NDZlZGUtMjAxOS00YTRkLTkwYmMtYWQ0NWEwZDZiNjEzXkEyXkFqcGdeQXVyMTMxODk2OTU@._V1_SX300.jpg,"[{'Source': 'Internet Movie Database', 'Value': '8.5/10'}, {'Source': 'Rotten Tomatoes', 'Value': '94%'}, {'Source': 'Metacritic', 'Value': '88/100'}]",88,8.5,"779,300",tt2582802,movie,02 Dec 2014,"$13,092,000",N/A,N/A,True,
8,Kingsman: The Secret Service,2014,R,13 Feb 2015,129 min,"Action, Adventure, Comedy",Matthew Vaughn,"Jane Goldman, Matthew Vaughn, Mark Millar","Colin Firth, Taron Egerton, Samuel L. Jackson","A spy organisation recruits a promising street kid into the agency's training program, while a global threat emerges from a twisted tech genius.","English, Arabic, Swedish","United Kingdom, United States",10 wins & 32 nominations,https://m.media-amazon.com/images/M/MV5BYTM3ZTllNzItNTNmOS00NzJiLTg1MWMtMjMxNDc0NmJhODU5XkEyXkFqcGdeQXVyODE5NzE3OTE@._V1_SX300.jpg,"[{'Source': 'Internet Movie Database', 'Value': '7.7/10'}, {'Source': 'Rotten Tomatoes', 'Value': '75%'}, {'Source': 'Metacritic', 'Value': '60/100'}]",60,7.7,"633,538",tt2802144,movie,09 Jun 2015,"$128,261,724",N/A,N/A,True,
9,Ex Machina,2014,R,24 Apr 2015,108 min,"Drama, Sci-Fi, Thriller",Alex Garland,Alex Garland,"Alicia Vikander, Domhnall Gleeson, Oscar Isaac",A young programmer is selected to participate in a ground-breaking experiment in synthetic intelligence by evaluating the human qualities of a highly advanced humanoid A.I.,English,United Kingdom,Won 1 Oscar. 73 wins & 161 nominations total,https://m.media-amazon.com/images/M/MV5BMTUxNzc0OTIxMV5BMl5BanBnXkFtZTgwNDI3NzU2NDE@._V1_SX300.jpg,"[{'Source': 'Internet Movie Database', 'Value': '7.7/10'}, {'Source': 'Rotten Tomatoes', 'Value': '92%'}, {'Source': 'Metacritic', 'Value': '78/100'}]",78,7.7,"515,240",tt0470752,movie,14 Jul 2015,"$25,442,958",N/A,N/A,True,
10,Divergent,2014,PG-13,21 Mar 2014,139 min,"Action, Adventure, Mystery",Neil Burger,"Evan Daugherty, Vanessa Taylor, Veronica Roth","Shailene Woodley, Theo James, Kate Winslet","In a world divided by factions based on virtues, Tris learns she's Divergent and won't fit in. When she discovers a plot to destroy Divergents, Tris and the mysterious Four must find out what makes Divergents dangerous before it's to","English, Spanish",United States,7 wins & 11 nominations,https://m.media-amazon.com/images/M/MV5BMTYxMzYwODE4OV5BMl5BanBnXkFtZTgwNDE5MzE2MDE@._V1_SX300.jpg,"[{'Source': 'Internet Movie Database', 'Value': '6.6/10'}, {'Source': 'Rotten Tomatoes', 'Value': '41%'}, {'Source': 'Metacritic', 'Value': '48/100'}]",48,6.6,"443,832",tt1840309,movie,05 Aug 2014,"$150,947,895",N/A,N/A,True,
11,Nightcrawler,2014,R,31 Oct 2014,117 min,"Crime, Drama, Thriller",Dan Gilroy,Dan Gilroy,"Jake Gyllenhaal, Rene Russo, Bill Paxton","When Louis Bloom, a con man desperate for work, muscles into the world of L.A. crime journalism, he blurs the line between observer and participant to become the star of his own story.",English,United States,Nominated for 1 Oscar. 42 wins & 124 nominations total,https://m.media-amazon.com/images/M/MV5BN2U1YzdhYWMtZWUzMi00OWI1LWFkM2ItNWVjM2YxMGQ2MmNhXkEyXkFqcGdeQXVyNjU0OTQ0OTY@._V1_SX300.jpg,"[{'Source': 'Internet Movie Database', 'Value': '7.8/10'}, {'Source': 'Rotten Tomatoes', 'Value': '95%'}, {'Source': 'Metacritic', 'Value': '76/100'}]",76,7.8,"505,637",tt2872718,movie,10 Feb 2015,"$32,381,217",N/A,N/A,True,
12,The Hobbit: The Battle of the Five Armies,2014,PG-13,17 Dec 2014,144 min,"Adventure, Fantasy",Peter Jackson,"Fran Walsh, Philippa Boyens, Peter Jackson","Ian McKellen, Martin Freeman, Richard Armitage",Bilbo and company are forced to engage in a war against an array of combatants and keep the Lonely Mountain from falling into the hands of a rising darkness.,English,"New Zealand, United States",Nominated for 1 Oscar. 8 wins & 55 nominations total,https://m.media-amazon.com/images/M/MV5BMTYzNDE3OTQ3MF5BMl5BanBnXkFtZTgwODczMTg4MjE@._V1_SX300.jpg,"[{'Source': 'Internet Movie Database', 'Value': '7.4/10'}, {'Source': 'Rotten Tomatoes', 'Value': '59%'}, {'Source': 'Metacritic', 'Value': '59/100'}]",59,7.4,"505,107",tt2310332,movie,08 Apr 2014,"$255,119,788",N/A,N/A,True,
13,The Equalizer,2014,R,26 Sep 2014,132 min,"Action, Crime, Thriller",Antoine Fuqua,"Richard Wenk, Michael Sloan, Richard Lindheim","Denzel Washington, Marton Csokas, Chloë Grace Moretz",A man who believes he has put his mysterious past behind him cannot stand idly by when he meets a young girl under the control of ultra-violent Russian gangsters.,"English, Russian, Spanish",United States,1 win & 9 nominations,https://m.media-amazon.com/images/M/MV5BMTQ2MzE2NTk0NF5BMl5BanBnXkFtZTgwOTM3NTk1MjE@._V1_SX300.jpg,"[{'Source': 'Internet Movie Database', 'Value': '7.2/10'}, {'Source': 'Rotten Tomatoes', 'Value': '60%'}, {'Source': 'Metacritic', 'Value': '57/100'}]",57,7.2,"357,197",tt0455944,movie,30 Dec 2014,"$101,530,738",N/A,N/A,True,
14,The Maze Runner,2014,PG-13,19 Sep 2014,113 min,"Action, Mystery, Sci-Fi",Wes Ball,"Noah Oppenheim, Grant Pierce Myers, T.S. Nowlin","Dylan O'Brien, Kaya Scodelario, Will Poulter","Thomas is deposited in a community of boys after his memory is erased, soon learning they're all trapped in a maze that will require him to join forces with fellow ""runners"" for a shot at escape.",English,"United States, United Kingdom",4 wins & 12 nominations,https://m.media-amazon.com/images/M/MV5BMjUyNTA3MTAyM15BMl5BanBnXkFtZTgwOTEyMTkyMjE@._V1_SX300.jpg,"[{'Source': 'Internet Movie Database', 'Value': '6.8/10'}, {'Source': 'Rotten Tomatoes', 'Value': '65%'}, {'Source': 'Metacritic', 'Value': '57/100'}]",57,6.8,"446,226",tt1790864,movie,16 Dec 2014,"$102,427,862",N/A,N/A,True,
15,Lucy,2014,R,25 Jul 2014,89 min,"Action, Sci-Fi, Thriller",Luc Besson,Luc Besson,"Scarlett Johansson, Morgan Freeman, Choi Min-sik","A woman, accidentally caught in a dark deal, turns the tables on her captors and transforms into a merciless warrior evolved beyond human logic.","English, Mandarin, French, Italian, German, Spanish, Korean","France, Germany, Taiwan, Canada, United States, United Kingdom",1 win & 12 nominations,https://m.media-amazon.com/images/M/MV5BODcxMzY3ODY1NF5BMl5BanBnXkFtZTgwNzg1NDY4MTE@._V1_SX300.jpg,"[{'Source': 'Internet Movie Database', 'Value': '6.4/10'}, {'Source': 'Rotten Tomatoes', 'Value': '67%'}, {'Source': 'Metacritic', 'Value': '61/100'}]",61,6.4,"473,109",tt2872732,movie,20 Jan 2015,"$126,663,600",N/A,N/A,True,
16,Chef,2014,R,30 May 2014,114 min,"Adventure, Comedy, Drama",Jon Favreau,Jon Favreau,"Jon Favreau, Robert Downey Jr., Scarlett Johansson","A head chef quits his restaurant job and buys a food truck in an effort to reclaim his creative promise, while piecing back together his estranged family.","English, Spanish",United States,2 wins & 4 nominations,https://m.media-amazon.com/images/M/MV5BYTQyNDQwMjYtZTY5YS00MGU2LWE5NzctMjM4Y2IyYjkwMjNkXkEyXkFqcGdeQXVyMTY5Nzc4MDY@._V1_SX300.jpg,"[{'Source': 'Internet Movie Database', 'Value': '7.3/10'}, {'Source': 'Rotten Tomatoes', 'Value': '87%'}, {'Source': 'Metacritic', 'Value': '68/100'}]",68,7.3,"209,508",tt2883512,movie,30 Sep 2014,"$31,424,003",N/A,N/A,True,
17,What We Do in the Shadows,2014,R,13 Feb 2015,86 min,"Comedy, Horror","Jemaine Clement, Taika Waititi","Jemaine Clement, Taika Waititi","Jemaine Clement, Taika Waititi, Cori Gonzalez-Macuer","Viago, Deacon, and Vladislav are vampires who are struggling with the mundane aspects of modern life, like paying rent, keeping up with the chore wheel, trying to get into nightclubs, and overcoming flatmate conflicts.","English, German, Spanish, Latin",New Zealand,26 wins & 18 nominations,https://m.media-amazon.com/images/M/MV5BMjAwNDA5NzEwM15BMl5BanBnXkFtZTgwMTA1MDUyNDE@._V1_SX300.jpg,"[{'Source': 'Internet Movie Database', 'Value': '7.7/10'}, {'Source': 'Rotten Tomatoes', 'Value': '96%'}, {'Source': 'Metacritic', 'Value': '76/100'}]",76,7.7,"174,018",tt3416742,movie,26 May 2015,"$3,469,224",N/A,N/A,True,
18,The Imitation Game,2014,PG-13,25 Dec 2014,114 min,"Biography, Drama, Thriller",Morten Tyldum,"Graham Moore, Andrew Hodges","Benedict Cumberbatch, Keira Knightley, Matthew Goode","During World War II, the English mathematical genius Alan Turing tries to crack the German Enigma code with help from fellow mathematicians while attempting to come to terms with his troubled private life.","English, German","United Kingdom, United States",Won 1 Oscar. 49 wins & 163 nominations total,https://m.media-amazon.com/images/M/MV5BOTgwMzFiMWYtZDhlNS00ODNkLWJiODAtZDVhNzgyNzJhYjQ4L2ltYWdlXkEyXkFqcGdeQXVyNzEzOTYxNTQ@._V1_SX300.jpg,"[{'Source': 'Internet Movie Database', 'Value': '8.0/10'}, {'Source': 'Rotten Tomatoes', 'Value': '89%'}, {'Source': 'Metacritic', 'Value': '71/100'}]",71,8.0,"733,812",tt2084970,movie,31 Mar 2015,"$91,125,683",N/A,N/A,True,
19,Fury,2014,R,17 Oct 2014,134 min,"Action, Drama, War",David Ayer,David Ayer,"Brad Pitt, Shia LaBeouf, Logan Lerman","A grizzled tank commander makes tough decisions as he and his crew fight their way across Germany in April, 1945.","English, German","United States, China, United Kingdom",5 wins & 24 nominations,https://m.media-amazon.com/images/M/MV5BMjA4MDU0NTUyN15BMl5BanBnXkFtZTgwMzQxMzY4MjE@._V1_SX300.jpg,"[{'Source': 'Internet Movie Database', 'Value': '7.6/10'}, {'Source': 'Rotten Tomatoes', 'Value': '76%'}, {'Source': 'Metacritic', 'Value': '64/100'}]",64,7.6,"461,509",tt2713180,movie,27 Jan 2015,"$85,817,906",N/A,N/A,True,
20,X-Men: Days of Future Past,2014,PG-13,23 May 2014,132 min,"Action, Adventure, Sci-Fi",Bryan Singer,"Simon Kinberg, Jane Goldman, Matthew Vaughn","Patrick Stewart, Ian McKellen, Hugh Jackman",The X-Men send Wolverine to the past in a desperate effort to change history and prevent an event that results in doom for both humans and mutants.,"English, Vietnamese, French","United States, United Kingdom",Nominated for 1 Oscar. 16 wins & 48 nominations total,https://m.media-amazon.com/images/M/MV5BZGIzNWYzN2YtMjcwYS00YjQ3LWI2NjMtOTNiYTUyYjE2MGNkXkEyXkFqcGdeQXVyMTQxNzMzNDI@._V1_SX300.jpg,"[{'Source': 'Internet Movie Database', 'Value': '7.9/10'}, {'Source': 'Rotten Tomatoes', 'Value': '90%'}, {'Source': 'Metacritic', 'Value': '75/100'}]",75,7.9,"687,967",tt1877832,movie,14 Oct 2014,"$233,921,534",N/A,N/A,True,
21,Predestination,2014,R,09 Jan 2015,97 min,"Action, Drama, Sci-Fi","Michael Spierig, Peter Spierig","Michael Spierig, Peter Spierig, Robert A. Heinlein","Ethan Hawke, Sarah Snook, Noah Taylor","For his final assignment, a top temporal agent must pursue the one criminal that has eluded him throughout time. The chase turns into a unique, surprising and mind-bending exploration of love, fate, identity and time travel taboos.",English,"Australia, United States",12 wins & 19 nominations,https://m.media-amazon.com/images/M/MV5BMTAzODc3NjU1NzNeQTJeQWpwZ15BbWU4MDk5NTQ4NTMx._V1_SX300.jpg,"[{'Source': 'Internet Movie Database', 'Value': '7.5/10'}, {'Source': 'Rotten Tomatoes', 'Value': '84%'}, {'Source': 'Metacritic', 'Value': '69/100'}]",69,7.5,"271,340",tt2397535,movie,10 Feb 2015,"$68,372",N/A,N/A,True,
22,The Purge: Anarchy,2014,R,18 Jul 2014,103 min,"Action, Horror, Sci-Fi",James DeMonaco,James DeMonaco,"Frank Grillo, Carmen Ejogo, Zach Gilford","Three groups of people intertwine and are left stranded in the streets on Purge Night, trying to survive the chaos and violence that occurs.",English,"United States, France",3 wins & 6 nominations,https://m.media-amazon.com/images/M/MV5BMjE2ODMxMTk1Nl5BMl5BanBnXkFtZTgwMDEzNjEzMTE@._V1_SX300.jpg,"[{'Source': 'Internet Movie Database', 'Value': '6.4/10'}, {'Source': 'Rotten Tomatoes', 'Value': '57%'}, {'Source': 'Metacritic', 'Value': '50/100'}]",50,6.4,"147,990",tt2975578,movie,21 Oct 2014,"$71,962,800",N/A,N/A,True,
23,Birdman or (The Unexpected Virtue of Ignorance),2014,R,14 Nov 2014,119 min,"Comedy, Drama",Alejandro G. Iñárritu,"Alejandro G. Iñárritu, Nicolás Giacobone, Alexander Dinelaris","Michael Keaton, Zach Galifianakis, Edward Norton","A washed-up superhero actor attempts to revive his fading career by writing, directing, and starring in a Broadway production.",English,United States,Won 4 Oscars. 193 wins & 291 nominations total,https://m.media-amazon.com/images/M/MV5BODAzNDMxMzAxOV5BMl5BanBnXkFtZTgwMDMxMjA4MjE@._V1_SX300.jpg,"[{'Source': 'Internet Movie Database', 'Value': '7.7/10'}, {'Source': 'Rotten Tomatoes', 'Value': '91%'}, {'Source': 'Metacritic', 'Value': '87/100'}]",87,7.7,"610,224",tt2562232,movie,17 Feb 2015,"$42,340,598",N/A,N/A,True,
24,It Follows,2014,R,13 Mar 2015,100 min,"Horror, Mystery, Thriller",David Robert Mitchell,David Robert Mitchell,"Maika Monroe, Keir Gilchrist, Olivia Luccardi",A young woman is followed by an unknown supernatural force after a sexual encounter.,English,United States,25 wins & 43 nominations,https://m.media-amazon.com/images/M/MV5BMmU0MjBlYzYtZWY0MC00MjliLWI3ZmUtMzhlZDVjMWVmYWY4XkEyXkFqcGdeQXVyMTQxNzMzNDI@._V1_SX300.jpg,"[{'Source': 'Internet Movie Database', 'Value': '6.8/10'}, {'Source': 'Rotten Tomatoes', 'Value': '96%'}, {'Source': 'Metacritic', 'Value': '83/100'}]",83,6.8,"226,947",tt3235888,movie,14 Jul 2015,"$14,674,076",N/A,N/A,True,
25,Blended,2014,PG-13,23 May 2014,117 min,"Comedy, Romance",Frank Coraci,"Ivan Menchell, Clare Sera","Adam Sandler, Drew Barrymore, Wendi McLendon-Covey","After a bad blind date, a man and woman find themselves stuck together at a resort for families, where their attraction grows as their respective kids benefit from the burgeoning relationship.",English,United States,1 win & 10 nominations,https://m.media-amazon.com/images/M/MV5BNzc2ODI5NjAyMl5BMl5BanBnXkFtZTgwMzIyOTE4MDE@._V1_SX300.jpg,"[{'Source': 'Internet Movie Database', 'Value': '6.5/10'}, {'Source': 'Rotten Tomatoes', 'Value': '15%'}, {'Source': 'Metacritic', 'Value': '31/100'}]",31,6.5,"127,713",tt1086772,movie,26 Aug 2014,"$46,294,610",N/A,N/A,True,
26,Hercules,1997,G,27 Jun 1997,93 min,"Animation, Adventure, Comedy","Ron Clements, John Musker","Ron Clements, John Musker, Don McEnery","Tate Donovan, Susan Egan, James Woods",The son of Zeus and Hera is stripped of his immortality as an infant and must become a true hero in order to reclaim it.,"English, Spanish, Greek",United States,Nominated for 1 Oscar. 9 wins & 16 nominations total,https://m.media-amazon.com/images/M/MV5BZDcwYjEyNWItMGI1Mi00MjI1LWIyMDEtMTQ4YjhkNjM4NDU3XkEyXkFqcGdeQXVyNDUyOTg3Njg@._V1_SX300.jpg,"[{'Source': 'Internet Movie Database', 'Value': '7.3/10'}, {'Source': 'Rotten Tomatoes', 'Value': '84%'}, {'Source': 'Metacritic', 'Value': '74/100'}]",74,7.3,"220,492",tt0119282,movie,03 Dec 2002,"$99,112,101",N/A,N/A,True,
27,The Judge,2014,R,10 Oct 2014,141 min,"Crime, Drama",David Dobkin,"Nick Schenk, Bill Dubuque, David Dobkin","Robert Downey Jr., Robert Duvall, Vera Farmiga","Big-city lawyer Hank Palmer returns to his childhood home where his father, the town's judge, is suspected of murder. Hank sets out to discover the truth and, along the way, reconnects with his estranged family.",English,United States,Nominated for 1 Oscar. 3 wins & 9 nominations total,https://m.media-amazon.com/images/M/MV5BMTcyNzIxOTIwMV5BMl5BanBnXkFtZTgwMzE0NjQwMjE@._V1_SX300.jpg,"[{'Source': 'Internet Movie Database', 'Value': '7.4/10'}, {'Source': 'Rotten Tomatoes', 'Value': '49%'}, {'Source': 'Metacritic', 'Value': '48/100'}]",48,7.4,"186,751",tt1872194,movie,27 Jan 2015,"$47,119,388",N/A,N/A,True,
28,Annie,1982,PG,18 Jun 1982,127 min,"Comedy, Drama, Family",John Huston,"Carol Sobieski, Thomas Meehan, Martin Charnin","Aileen Quinn, Albert Finney, Carol Burnett","A spunky young orphan is taken in by a rich eccentric, much to the chagrin of the cantankerous woman who runs the orphanage.",English,United States,Nominated for 2 Oscars. 2 wins & 13 nominations total,https://m.media-amazon.com/images/M/MV5BYzU2YzA3NTYtNDg3OS00YTg3LThiODctZTQ3MzhkZDVjZDNlXkEyXkFqcGdeQXVyNjc1NTYyMjg@._V1_SX300.jpg,"[{'Source': 'Internet Movie Database', 'Value': '6.6/10'}, {'Source': 'Rotten Tomatoes', 'Value': '53%'}, {'Source': 'Metacritic', 'Value': '39/100'}]",39,6.6,"43,984",tt0083564,movie,13 Jan 2004,"$57,059,003",N/A,N/A,True,
29,Godzilla,2014,PG-13,16 May 2014,123 min,"Action, Adventure, Sci-Fi",Gareth Edwards,"Ishirô Honda, Takeo Murata, Shigeru Kayama","Aaron Taylor-Johnson, Elizabeth Olsen, Bryan Cranston","The world is beset by the appearance of monstrous creatures, but one of them may be the only one who can save humanity.","English, Japanese","United States, Japan",7 wins & 31 nominations,https://m.media-amazon.com/images/M/MV5BZDFmYTM4NzAtNWM0ZC00MGJlLWEyYzQtYzA3ZTFiNzc1YjllXkEyXkFqcGdeQXVyMTA4NjE0NjEy._V1_SX300.jpg,"[{'Source': 'Internet Movie Database', 'Value': '6.4/10'}, {'Source': 'Rotten Tomatoes', 'Value': '76%'}, {'Source': 'Metacritic', 'Value': '62/100'}]",62,6.4,"403,102",tt0831387,movie,16 Sep 2014,"$200,676,069",N/A,N/A,True,
30,The Giver,2014,PG-13,15 Aug 2014,97 min,"Drama, Romance, Sci-Fi",Phillip Noyce,"Michael Mitnick, Robert B. Weide, Lois Lowry","Brenton Thwaites, Jeff Bridges, Meryl Streep","In a seemingly perfect community, without war, pain, suffering, differences or choice, a young boy is chosen to learn from an elderly man about the true pain and pleasure of the ""real"" world.",English,"United States, South Africa, Canada",3 wins & 6 nominations,https://m.media-amazon.com/images/M/MV5BMTY1MTIxMjg2Ml5BMl5BanBnXkFtZTgwMjUyNzgwMjE@._V1_SX300.jpg,"[{'Source': 'Internet Movie Database', 'Value': '6.5/10'}, {'Source': 'Rotten Tomatoes', 'Value': '35%'}, {'Source': 'Metacritic', 'Value': '47/100'}]",47,6.5,"116,380",tt0435651,movie,25 Nov 2014,"$45,090,374",N/A,N/A,True,
31,300: Rise of an Empire,2014,R,07 Mar 2014,102 min,"Action, Drama",Noam Murro,"Zack Snyder, Kurt Johnstad, Frank Miller","Sullivan Stapleton, Eva Green, Lena Headey","Greek general Themistokles of Athens leads the naval charge against invading Persian forces led by mortal-turned-god Xerxes and Artemisia, vengeful commander of the Persian navy.",English,United States,2 wins & 7 nominations,https://m.media-amazon.com/images/M/MV5BMTEwNTU2MjAwMDdeQTJeQWpwZ15BbWU3MDk2Njc2Njk@._V1_SX300.jpg,"[{'Source': 'Internet Movie Database', 'Value': '6.2/10'}, {'Source': 'Rotten Tomatoes', 'Value': '45%'}, {'Source': 'Metacritic', 'Value': '48/100'}]",48,6.2,"291,961",tt1253863,movie,24 Jun 2014,"$106,580,051",N/A,N/A,True,
32,American Sniper,2014,R,16 Jan 2015,133 min,"Action, Biography, Drama",Clint Eastwood,"Jason Hall, Chris Kyle, Scott McEwen","Bradley Cooper, Sienna Miller, Kyle Gallner","Navy S.E.A.L. sniper Chris Kyle's pinpoint accuracy saves countless lives on the battlefield and turns him into a legend. Back home with his family after four tours of duty, however, Chris finds that it is the war he can't leave behi","English, Arabic",United States,Won 1 Oscar. 24 wins & 43 nominations total,https://m.media-amazon.com/images/M/MV5BMTkxNzI3ODI4Nl5BMl5BanBnXkFtZTgwMjkwMjY4MjE@._V1_SX300.jpg,"[{'Source': 'Internet Movie Database', 'Value': '7.3/10'}, {'Source': 'Rotten Tomatoes', 'Value': '72%'}, {'Source': 'Metacritic', 'Value': '72/100'}]",72,7.3,"465,455",tt2179136,movie,19 May 2015,"$350,126,372",N/A,N/A,True,
33,"Love, Rosie",2014,R,22 Oct 2014,102 min,"Comedy, Romance",Christian Ditter,"Juliette Towhidi, Cecelia Ahern","Lily Collins, Sam Claflin, Christian Cooke","Rosie and Alex have been best friends since they were 5, so they couldn't possibly be right for one another...or could they? When it comes to love, life and making the right choices, these two are their own worst enemies.",English,"Germany, United Kingdom",N/A,https://m.media-amazon.com/images/M/MV5BMTk0Mzg1MTU1MF5BMl5BanBnXkFtZTgwMjU3ODI2MzE@._V1_SX300.jpg,"[{'Source': 'Internet Movie Database', 'Value': '7.2/10'}, {'Source': 'Rotten Tomatoes', 'Value': '32%'}, {'Source': 'Metacritic', 'Value': '44/100'}]",44,7.2,"132,568",tt1638002,movie,05 May 2015,"$20,431",N/A,N/A,True,
