,Title,Year,Rated,Released,Runtime,Genre,Director,Writer,Actors,Plot,Language,Country,Awards,Poster,Ratings,Metascore,imdbRating,imdbVotes,imdbID,Type,DVD,BoxOffice,Production,Website,Response,totalSeasons,Error
284,The Hunter,2011,R,06 Oct 2011,100 min,"Adventure, Drama, Thriller",Daniel Nettheim,"Alice Addison, Wain Fimeri, Daniel Nettheim","Willem Dafoe, Sam Neill, Morgan Davies","Martin, a mercenary, is sent from Europe by a mysterious biotech company to the Tasmanian wilderness on a hunt for the last Tasmanian tiger.",English,Australia,4 wins & 23 nominations,https://m.media-amazon.com/images/M/MV5BNTI4Mzc0MTg4OV5BMl5BanBnXkFtZTcwNTc1NDQzNw@@._V1_SX300.jpg,"[{'Source': 'Internet Movie Database', 'Value': '6.7/10'}, {'Source': 'Rotten Tomatoes', 'Value': '72%'}, {'Source': 'Metacritic', 'Value': '63/100'}]",63,6.7,"38,369",tt1703148,movie,03 Jul 2012,"$176,669",N/A,N/A,True,,
285,The Thing,1982,R,25 Jun 1982,109 min,"Horror, Mystery, Sci-Fi",John Carpenter,"Bill Lancaster, John W. Campbell Jr.","Kurt Russell, Wilford Brimley, Keith David",A research team in Antarctica is hunted by a shape-shifting alien that assumes the appearance of its victims.,"English, Norwegian","United States, Canada",3 nominations,https://m.media-amazon.com/images/M/MV5BNGViZWZmM2EtNGYzZi00ZDAyLTk3ODMtNzIyZTBjN2Y1NmM1XkEyXkFqcGdeQXVyNTAyODkwOQ@@._V1_SX300.jpg,"[{'Source': 'Internet Movie Database', 'Value': '8.1/10'}, {'Source': 'Rotten Tomatoes', 'Value': '82%'}, {'Source': 'Metacritic', 'Value': '57/100'}]",57,8.1,"399,747",tt0084787,movie,14 Feb 2006,"$19,629,760",N/A,N/A,True,,
286,Drive Angry,2011,R,25 Feb 2011,104 min,"Action, Fantasy, Thriller",Patrick Lussier,"Todd Farmer, Patrick Lussier","Nicolas Cage, Amber Heard, William Fichtner",A vengeful father escapes from hell and chases after the men who killed his daughter and kidnapped his granddaughter.,English,United States,1 win & 6 nominations,https://m.media-amazon.com/images/M/MV5BMjIwNTM4Njg2NF5BMl5BanBnXkFtZTcwNDQwMTAwNA@@._V1_SX300.jpg,"[{'Source': 'Internet Movie Database', 'Value': '5.4/10'}, {'Source': 'Rotten Tomatoes', 'Value': '48%'}, {'Source': 'Metacritic', 'Value': '44/100'}]",44,5.4,"97,316",tt1502404,movie,31 May 2011,"$10,721,033",N/A,N/A,True,,
287,Jack and Jill,2011,PG,11 Nov 2011,91 min,Comedy,Dennis Dugan,"Ben Zook, Steve Koren, Adam Sandler","Adam Sandler, Katie Holmes, Al Pacino","Family guy, Jack Sadelstein, prepares for the annual event he always dreads--the Thanksgiving visit of his fraternal twin sister, the needy, and passive-aggressive Jill, who then refuses to leave.",English,United States,14 wins & 5 nominations,https://m.media-amazon.com/images/M/MV5BNjczMTU5OTUyMl5BMl5BanBnXkFtZTcwODEzNjc3Ng@@._V1_SX300.jpg,"[{'Source': 'Internet Movie Database', 'Value': '3.3/10'}, {'Source': 'Rotten Tomatoes', 'Value': '3%'}, {'Source': 'Metacritic', 'Value': '23/100'}]",23,3.3,"82,390",tt0810913,movie,06 Mar 2012,"$74,158,157",N/A,N/A,True,,
288,Zookeeper,2011,PG,08 Jul 2011,102 min,"Comedy, Family, Fantasy",Frank Coraci,"Nick Bakay, Rock Reuben, Kevin James","Kevin James, Rosario Dawson, Leslie Bibb","A group of zoo animals decide to break their code of silence in order to help their lovable zookeeper find love, without opting to leave his current job for something more illustrious.",English,United States,1 win & 2 nominations,https://m.media-amazon.com/images/M/MV5BMTMyNjYyODk0Ml5BMl5BanBnXkFtZTcwNDUzOTczNQ@@._V1_SX300.jpg,"[{'Source': 'Internet Movie Database', 'Value': '5.2/10'}, {'Source': 'Rotten Tomatoes', 'Value': '14%'}, {'Source': 'Metacritic', 'Value': '30/100'}]",30,5.2,"60,182",tt1222817,movie,11 Oct 2011,"$80,360,843",N/A,N/A,True,,
289,The Hangover Part II,2011,R,26 May 2011,102 min,Comedy,Todd Phillips,"Craig Mazin, Scot Armstrong, Todd Phillips","Bradley Cooper, Zach Galifianakis, Ed Helms","Two years after the bachelor party in Las Vegas, Phil, Stu, Alan, and Doug jet to Thailand for Stu's wedding. Stu's plan for a subdued pre-wedding brunch, however, goes seriously awry.","English, Thai",United States,5 wins & 18 nominations,https://m.media-amazon.com/images/M/MV5BMTM2MTM4MzY2OV5BMl5BanBnXkFtZTcwNjQ3NzI4NA@@._V1_SX300.jpg,"[{'Source': 'Internet Movie Database', 'Value': '6.5/10'}, {'Source': 'Rotten Tomatoes', 'Value': '34%'}, {'Source': 'Metacritic', 'Value': '44/100'}]",44,6.5,"484,742",tt1411697,movie,06 Dec 2011,"$254,464,305",N/A,N/A,True,,
290,Hall Pass,2011,R,25 Feb 2011,105 min,"Comedy, Romance","Bobby Farrelly, Peter Farrelly","Pete Jones, Peter Farrelly, Kevin Barnett","Owen Wilson, Jason Sudeikis, Christina Applegate","Rick and Fred, two husbands who are having difficulty in their marriages, are given a Hall Pass by their wives: for one week, they can do whatever they want.",English,United States,N/A,https://m.media-amazon.com/images/M/MV5BMTc4MzIxNTYwNl5BMl5BanBnXkFtZTcwNzE4MjE0NA@@._V1_SX300.jpg,"[{'Source': 'Internet Movie Database', 'Value': '5.8/10'}, {'Source': 'Rotten Tomatoes', 'Value': '33%'}, {'Source': 'Metacritic', 'Value': '45/100'}]",45,5.8,"124,036",tt0480687,movie,14 Jun 2011,"$45,060,734",N/A,N/A,True,,
291,The Best Exotic Marigold Hotel,2011,PG-13,25 May 2012,124 min,"Comedy, Drama, Romance",John Madden,"Ol Parker, Deborah Moggach","Judi Dench, Bill Nighy, Maggie Smith","British retirees travel to India to take up residence in what they believe is a newly restored hotel. Less luxurious than advertised, the Marigold Hotel nevertheless slowly begins to charm in unexpected ways.","English, Hindi",United Kingdom,Nominated for 1 BAFTA Film Award4 wins & 22 nominations total,https://m.media-amazon.com/images/M/MV5BMjIwNjkwMDI2NV5BMl5BanBnXkFtZTcwNDc1ODIyNw@@._V1_SX300.jpg,"[{'Source': 'Internet Movie Database', 'Value': '7.3/10'}, {'Source': 'Rotten Tomatoes', 'Value': '78%'}, {'Source': 'Metacritic', 'Value': '62/100'}]",62,7.3,"93,714",tt1412386,movie,18 Sep 2012,"$46,412,041",N/A,N/A,True,,
292,The Grey,2011,R,27 Jan 2012,117 min,"Action, Adventure, Drama",Joe Carnahan,"Joe Carnahan, Ian Mackenzie Jeffers","Liam Neeson, Dermot Mulroney, Frank Grillo","After their plane crashes in Alaska, six oil workers are led by a skilled huntsman to survival, but a pack of merciless wolves haunts their every step.","English, Spanish",United States,2 wins & 8 nominations,https://m.media-amazon.com/images/M/MV5BNDY4MTQwMzc1MV5BMl5BanBnXkFtZTcwNzcwNTM5Ng@@._V1_SX300.jpg,"[{'Source': 'Internet Movie Database', 'Value': '6.8/10'}, {'Source': 'Rotten Tomatoes', 'Value': '79%'}, {'Source': 'Metacritic', 'Value': '64/100'}]",64,6.8,"248,381",tt1601913,movie,22 May 2012,"$51,580,236",N/A,N/A,True,,
293,The Sitter,2011,R,09 Dec 2011,81 min,Comedy,David Gordon Green,"Brian Gatewood, Alessandro Tanaka","Jonah Hill, Ari Graynor, Sam Rockwell","A college student on suspension is coaxed into babysitting the kids next door, though he is fully unprepared for the wild night ahead of him.",English,United States,2 nominations,https://m.media-amazon.com/images/M/MV5BZDU1ZWJmMmUtM2Q5Ny00MjdhLWE0OTMtMWJkMjg1OTc2YTgxXkEyXkFqcGdeQXVyNDk3NzU2MTQ@._V1_SX300.jpg,"[{'Source': 'Internet Movie Database', 'Value': '5.7/10'}, {'Source': 'Rotten Tomatoes', 'Value': '22%'}, {'Source': 'Metacritic', 'Value': '39/100'}]",39,5.7,"70,140",tt1366344,movie,17 Apr 2012,"$30,441,326",N/A,N/A,True,,
294,Take Me Home Tonight,2011,R,04 Mar 2011,97 min,"Comedy, Drama, Romance",Michael Dowse,"Jackie Filgo, Jeff Filgo, Topher Grace","Topher Grace, Anna Faris, Dan Fogler","Four years after graduation, an awkward high school genius uses his sister's boyfriend's Labor Day party as the perfect opportunity to make his move on his high school crush.",English,"United States, Germany",1 nomination,https://m.media-amazon.com/images/M/MV5BNjc2OTg5NTM1NV5BMl5BanBnXkFtZTcwODM3MTMyNA@@._V1_SX300.jpg,"[{'Source': 'Internet Movie Database', 'Value': '6.3/10'}, {'Source': 'Rotten Tomatoes', 'Value': '28%'}, {'Source': 'Metacritic', 'Value': '42/100'}]",42,6.3,"52,866",tt0810922,movie,19 Jul 2011,"$6,928,068",N/A,N/A,True,,
295,The Mechanic,2011,R,28 Jan 2011,93 min,"Action, Crime, Thriller",Simon West,"Richard Wenk, Lewis John Carlino","Jason Statham, Ben Foster, Donald Sutherland",An elite hitman teaches his trade to an apprentice who has a connection to one of his previous victims.,English,United States,1 nomination,https://m.media-amazon.com/images/M/MV5BMjEyMjk1NjI1M15BMl5BanBnXkFtZTcwODcyNjAxNA@@._V1_SX300.jpg,"[{'Source': 'Internet Movie Database', 'Value': '6.6/10'}, {'Source': 'Rotten Tomatoes', 'Value': '53%'}, {'Source': 'Metacritic', 'Value': '49/100'}]",49,6.6,"157,595",tt0472399,movie,17 May 2011,"$29,121,498",N/A,N/A,True,,
296,Ghost Rider: Spirit of Vengeance,2011,PG-13,17 Feb 2012,96 min,"Action, Fantasy, Thriller","Mark Neveldine, Brian Taylor","Scott M. Gimple, Seth Hoffman, David S. Goyer","Nicolas Cage, Ciarán Hinds, Idris Elba","Johnny Blaze, tortured by the Ghost Rider's curse, gets a chance of redemption through protecting the Devil's son, whose father is pursuing him.","English, Romanian","United States, United Arab Emirates",4 nominations,https://m.media-amazon.com/images/M/MV5BY2UxNDYxMmUtZDQwOC00NjhhLTk4MjgtMWNiYWZhMDg3Nzg4XkEyXkFqcGdeQXVyMjQwMjk0NjI@._V1_SX300.jpg,"[{'Source': 'Internet Movie Database', 'Value': '4.3/10'}, {'Source': 'Rotten Tomatoes', 'Value': '18%'}, {'Source': 'Metacritic', 'Value': '34/100'}]",34,4.3,"116,435",tt1071875,movie,12 Jun 2012,"$51,774,002",N/A,N/A,True,,
297,Battle Los Angeles,2011,PG-13,11 Mar 2011,116 min,"Action, Sci-Fi",Jonathan Liebesman,Christopher Bertolini,"Aaron Eckhart, Michelle Rodriguez, Bridget Moynahan",A squad of U.S. Marines becomes the last line of defense against a global invasion.,"English, Ukrainian",United States,1 win & 4 nominations,https://m.media-amazon.com/images/M/MV5BMDg2NzQwOGMtMGRkNC00YjAwLTg4NjgtZWQwYzljZmM1YzA4XkEyXkFqcGdeQXVyNTIzOTk5ODM@._V1_SX300.jpg,"[{'Source': 'Internet Movie Database', 'Value': '5.7/10'}, {'Source': 'Rotten Tomatoes', 'Value': '36%'}, {'Source': 'Metacritic', 'Value': '37/100'}]",37,5.7,"178,209",tt1217613,movie,14 Jun 2011,"$83,552,429",N/A,N/A,True,,
298,The Green Hornet,2011,PG-13,14 Jan 2011,119 min,"Action, Comedy, Crime",Michel Gondry,"Seth Rogen, Evan Goldberg, George W. Trendle","Seth Rogen, Jay Chou, Christoph Waltz","Following the death of his father, Britt Reid, heir to his father's large company, teams up with his late dad's assistant Kato to become a masked crime fighting team.","English, Mandarin",United States,4 wins & 7 nominations,https://m.media-amazon.com/images/M/MV5BYjlhN2U3OWUtNThiNi00ZWRhLWFlZDktOTcyMDk0NmM1OTA4XkEyXkFqcGdeQXVyNTIzOTk5ODM@._V1_SX300.jpg,"[{'Source': 'Internet Movie Database', 'Value': '5.8/10'}, {'Source': 'Rotten Tomatoes', 'Value': '44%'}, {'Source': 'Metacritic', 'Value': '39/100'}]",39,5.8,"159,049",tt0990407,movie,03 May 2011,"$98,780,042",N/A,N/A,True,,
299,Killer Elite,2011,R,23 Sep 2011,116 min,"Action, Crime, Thriller",Gary McKendry,"Matt Sherring, Ranulph Fiennes","Jason Statham, Clive Owen, Robert De Niro","When his mentor is taken captive by a disgraced Arab sheik, a killer-for-hire is forced into action. His mission: kill three members of Britain's elite Special Air Service responsible for the death of his sons.","English, Arabic, French, Spanish","United Kingdom, Australia",2 wins & 8 nominations,https://m.media-amazon.com/images/M/MV5BMTc4MDAxMjAzNV5BMl5BanBnXkFtZTcwNTY3ODg3NQ@@._V1_SX300.jpg,"[{'Source': 'Internet Movie Database', 'Value': '6.4/10'}, {'Source': 'Rotten Tomatoes', 'Value': '28%'}, {'Source': 'Metacritic', 'Value': '44/100'}]",44,6.4,"127,858",tt1448755,movie,10 Jan 2012,"$25,124,966",N/A,N/A,True,,
300,Shark Night,2011,PG-13,02 Sep 2011,90 min,"Horror, Thriller",David R. Ellis,"Will Hayes, Jesse Studenberg","Sara Paxton, Dustin Milligan, Chris Carmack",A weekend at a lake house in the Louisiana Gulf turns into a nightmare for seven vacationers as they are subjected to shark attacks.,English,United States,1 nomination,https://m.media-amazon.com/images/M/MV5BYjIwMDBlODEtZGRkMy00YTFiLWE5NDgtZGExODI2ZmIwZTQzXkEyXkFqcGdeQXVyMjQwMjk0NjI@._V1_SX300.jpg,"[{'Source': 'Internet Movie Database', 'Value': '4.0/10'}, {'Source': 'Rotten Tomatoes', 'Value': '18%'}, {'Source': 'Metacritic', 'Value': '22/100'}]",22,4.0,"25,728",tt1633356,movie,03 Jan 2012,"$18,877,153",N/A,N/A,True,,
301,J. Edgar,2011,R,11 Nov 2011,137 min,"Biography, Drama, Romance",Clint Eastwood,Dustin Lance Black,"Leonardo DiCaprio, Armie Hammer, Naomi Watts","J. Edgar Hoover, powerful head of the F.B.I. for nearly fifty years, looks back on his professional and personal life.",English,United States,5 wins & 17 nominations,https://m.media-amazon.com/images/M/MV5BMTc0NDM4ODU2Nl5BMl5BanBnXkFtZTcwNzQ0NTg4Ng@@._V1_SX300.jpg,"[{'Source': 'Internet Movie Database', 'Value': '6.5/10'}, {'Source': 'Rotten Tomatoes', 'Value': '43%'}, {'Source': 'Metacritic', 'Value': '59/100'}]",59,6.5,"126,719",tt1616195,movie,21 Feb 2012,"$37,306,030",N/A,N/A,True,,
302,Dream House,2011,PG-13,30 Sep 2011,92 min,"Drama, Mystery, Thriller",Jim Sheridan,David Loucka,"Daniel Craig, Rachel Weisz, Naomi Watts","Soon after moving into their seemingly idyllic new home, a family learns of a brutal crime committed against former residents of the dwelling.",English,"United States, Canada",2 nominations,https://m.media-amazon.com/images/M/MV5BOTMwYmU5ZjEtZmM3ZC00N2Q3LWIzMWUtODVhODE4Nzc4YzhkXkEyXkFqcGdeQXVyMTExNzQ3MzAw._V1_SX300.jpg,"[{'Source': 'Internet Movie Database', 'Value': '6.0/10'}, {'Source': 'Rotten Tomatoes', 'Value': '6%'}, {'Source': 'Metacritic', 'Value': '35/100'}]",35,6.0,"65,901",tt1462041,movie,31 Jan 2012,"$21,302,340",N/A,N/A,True,,
303,Haywire,2011,R,20 Jan 2012,93 min,"Action, Drama, Thriller",Steven Soderbergh,Lem Dobbs,"Gina Carano, Ewan McGregor, Michael Fassbender",A black ops super soldier seeks payback after she is betrayed and set up during a mission.,"English, Spanish","Ireland, United States",7 nominations,https://m.media-amazon.com/images/M/MV5BMjI2MjIxOTUwN15BMl5BanBnXkFtZTcwNDM5NjcxNw@@._V1_SX300.jpg,"[{'Source': 'Internet Movie Database', 'Value': '5.8/10'}, {'Source': 'Rotten Tomatoes', 'Value': '80%'}, {'Source': 'Metacritic', 'Value': '67/100'}]",67,5.8,"86,180",tt1506999,movie,01 May 2012,"$18,942,396",N/A,N/A,True,,
304,A Dangerous Method,2011,R,10 Nov 2011,99 min,"Biography, Drama, Romance",David Cronenberg,"Christopher Hampton, John Kerr","Michael Fassbender, Keira Knightley, Viggo Mortensen",A look at how the intense relationship between Carl Jung and Sigmund Freud gives birth to psychoanalysis.,English,"United Kingdom, Germany, Canada, United States",18 wins & 28 nominations,https://m.media-amazon.com/images/M/MV5BMTU5Mjk3NjgxMl5BMl5BanBnXkFtZTcwMDM5MjA5Ng@@._V1_SX300.jpg,"[{'Source': 'Internet Movie Database', 'Value': '6.4/10'}, {'Source': 'Rotten Tomatoes', 'Value': '78%'}, {'Source': 'Metacritic', 'Value': '76/100'}]",76,6.4,"101,838",tt1571222,movie,13 Mar 2012,"$5,704,709",N/A,N/A,True,,
305,The Muppets,2011,PG,23 Nov 2011,103 min,"Adventure, Comedy, Family",James Bobin,"Jason Segel, Nicholas Stoller, Jim Henson","Amy Adams, Jason Segel, Chris Cooper",A Muppet fanatic with some help from his 2 human compatriots must regroup the Muppet gang to stop an avaricious oil mogul from taking down one of their precious life-longing treasures.,English,"United States, United Kingdom, France",Won 1 Oscar. 17 wins & 43 nominations total,https://m.media-amazon.com/images/M/MV5BMjE0MTM4NTc3NF5BMl5BanBnXkFtZTcwMjYzOTIxNg@@._V1_SX300.jpg,"[{'Source': 'Internet Movie Database', 'Value': '7.1/10'}, {'Source': 'Rotten Tomatoes', 'Value': '95%'}, {'Source': 'Metacritic', 'Value': '75/100'}]",75,7.1,"90,642",tt1204342,movie,20 Mar 2012,"$88,631,237",N/A,N/A,True,,
306,The Smurfs,2011,PG,29 Jul 2011,103 min,"Animation, Adventure, Comedy",Raja Gosnell,"J. David Stem, David N. Weiss, Jay Scherick","Hank Azaria, Katy Perry, Jonathan Winters","When the evil wizard Gargamel chases the tiny blue Smurfs out of their village, they tumble from their magical world into New York City.",English,"United States, Belgium, Canada",2 wins & 8 nominations,https://m.media-amazon.com/images/M/MV5BNDUyMmFiYTctZDcyYS00OGY4LTk1ZmYtZjBmODBlZTc1NjU4XkEyXkFqcGdeQXVyNTk1MTAyODc@._V1_SX300.jpg,"[{'Source': 'Internet Movie Database', 'Value': '5.4/10'}, {'Source': 'Rotten Tomatoes', 'Value': '21%'}, {'Source': 'Metacritic', 'Value': '30/100'}]",30,5.4,"88,044",tt0472181,movie,21 Sep 2011,"$142,614,158",N/A,N/A,True,,
307,The Ides of March,2011,R,07 Oct 2011,101 min,"Drama, Thriller",George Clooney,"George Clooney, Grant Heslov, Beau Willimon","Paul Giamatti, George Clooney, Philip Seymour Hoffman",An idealistic staffer for a new presidential candidate gets a crash course on dirty politics during his stint on the campaign trail.,English,United States,Nominated for 1 Oscar. 9 wins & 36 nominations total,https://m.media-amazon.com/images/M/MV5BNTU4MjkzNTY0OF5BMl5BanBnXkFtZTcwNDI5ODIxNg@@._V1_SX300.jpg,"[{'Source': 'Internet Movie Database', 'Value': '7.1/10'}, {'Source': 'Rotten Tomatoes', 'Value': '84%'}, {'Source': 'Metacritic', 'Value': '67/100'}]",67,7.1,"220,434",tt1124035,movie,17 Jan 2012,"$40,962,534",N/A,N/A,True,,
308,Fright Night,2011,R,19 Aug 2011,106 min,"Comedy, Horror",Craig Gillespie,"Marti Noxon, Tom Holland","Anton Yelchin, Colin Farrell, David Tennant","When a nice new neighbor moves in next door, Charley discovers that he is an ancient vampire who preys on the community. Can he save his neighborhood from the creature with the help of the famous ""vampire killer"", Peter Vincent?",English,United States,2 wins & 8 nominations,https://m.media-amazon.com/images/M/MV5BMTU2MDc0NDY0M15BMl5BanBnXkFtZTcwOTgzMTYyNQ@@._V1_SX300.jpg,"[{'Source': 'Internet Movie Database', 'Value': '6.4/10'}, {'Source': 'Rotten Tomatoes', 'Value': '72%'}, {'Source': 'Metacritic', 'Value': '64/100'}]",64,6.4,"103,957",tt1438176,movie,07 Oct 2008,"$18,302,607",N/A,N/A,True,,
309,Soul Surfer,2011,PG,08 Apr 2011,112 min,"Biography, Drama, Family",Sean McNamara,"Sean McNamara, Deborah Schwartz, Douglas Schwartz","AnnaSophia Robb, Dennis Quaid, Helen Hunt",Teenage surfer Bethany Hamilton overcomes the odds and her own fears of returning to the water after losing her left arm in a shark attack.,English,United States,2 wins & 12 nominations,https://m.media-amazon.com/images/M/MV5BMTU2MDg0OTYyM15BMl5BanBnXkFtZTcwMjg5MjY0NA@@._V1_SX300.jpg,"[{'Source': 'Internet Movie Database', 'Value': '7.0/10'}, {'Source': 'Rotten Tomatoes', 'Value': '45%'}, {'Source': 'Metacritic', 'Value': '53/100'}]",53,7.0,"48,381",tt1596346,movie,02 Aug 2011,"$43,853,424",N/A,N/A,True,,
310,The Artist,2011,PG-13,20 Jan 2012,100 min,"Comedy, Drama, Romance",Michel Hazanavicius,Michel Hazanavicius,"Jean Dujardin, Bérénice Bejo, John Goodman",An egomaniacal film star develops a relationship with a young dancer against the backdrop of Hollywood's silent era.,English,"France, Belgium, United States",Won 5 Oscars. 162 wins & 204 nominations total,https://m.media-amazon.com/images/M/MV5BMDUyZWU5N2UtOWFlMy00MTI0LTk0ZDYtMzFhNjljODBhZDA5XkEyXkFqcGdeQXVyNzA4ODc3ODU@._V1_SX300.jpg,"[{'Source': 'Internet Movie Database', 'Value': '7.9/10'}, {'Source': 'Rotten Tomatoes', 'Value': '95%'}, {'Source': 'Metacritic', 'Value': '89/100'}]",89,7.9,"237,714",tt1655442,movie,24 Apr 2012,"$44,671,682",N/A,N/A,True,,
311,Water for Elephants,2011,PG-13,22 Apr 2011,120 min,"Drama, Romance",Francis Lawrence,"Richard LaGravenese, Sara Gruen","Robert Pattinson, Reese Witherspoon, Christoph Waltz","Set in the 1930s, a former veterinary student takes a job in a travelling circus and falls in love with the ringmaster's wife.","English, Polish",United States,3 wins & 13 nominations,https://m.media-amazon.com/images/M/MV5BMTQzMDU3NDEwN15BMl5BanBnXkFtZTcwMTI3MDU0NA@@._V1_SX300.jpg,"[{'Source': 'Internet Movie Database', 'Value': '6.9/10'}, {'Source': 'Rotten Tomatoes', 'Value': '60%'}, {'Source': 'Metacritic', 'Value': '52/100'}]",52,6.9,"114,629",tt1067583,movie,01 Nov 2011,"$58,709,717",N/A,N/A,True,,
312,"Oslo, August 31st",2011,Not Rated,31 Aug 2011,95 min,Drama,Joachim Trier,"Pierre Drieu La Rochelle, Joachim Trier, Eskil Vogt","Anders Danielsen Lie, Hans Olav Brenner, Ingrid Olava","One day in the life of Anders, a young recovering drug addict, who takes a brief leave from his treatment center to interview for a job and catch up with old friends in Oslo.","Norwegian, English","Norway, Denmark, Sweden",19 wins & 20 nominations,https://m.media-amazon.com/images/M/MV5BMTM5ODEwOTM0OV5BMl5BanBnXkFtZTcwOTQ3NzI3Nw@@._V1_SX300.jpg,"[{'Source': 'Internet Movie Database', 'Value': '7.6/10'}, {'Source': 'Rotten Tomatoes', 'Value': '97%'}, {'Source': 'Metacritic', 'Value': '84/100'}]",84,7.6,"21,851",tt1736633,movie,18 Sep 2012,"$101,475",N/A,N/A,True,,
313,The Snowtown Murders,2011,Not Rated,19 May 2011,119 min,"Biography, Crime, Drama",Justin Kurzel,"Shaun Grant, Justin Kurzel, Debi Marshall","Lucas Pittaway, Daniel Henshall, Louise Harris","Based on true events, 16 year-old Jamie falls in with his mother's new boyfriend and his crowd of self-appointed neighborhood watchmen, a relationship that leads to a spree of torture and murder.",English,Australia,23 wins & 23 nominations,https://m.media-amazon.com/images/M/MV5BMTM1NTE3MjkxM15BMl5BanBnXkFtZTcwMjE1Nzg4NA@@._V1_SX300.jpg,"[{'Source': 'Internet Movie Database', 'Value': '6.6/10'}, {'Source': 'Rotten Tomatoes', 'Value': '84%'}, {'Source': 'Metacritic', 'Value': '66/100'}]",66,6.6,"18,335",tt1680114,movie,14 Aug 2012,"$8,452",N/A,N/A,True,,
314,Something Borrowed,2011,PG-13,06 May 2011,112 min,"Comedy, Drama, Romance",Luke Greenfield,"Jennie Snyder Urman, Emily Giffin","Ginnifer Goodwin, Kate Hudson, Colin Egglesfield","Friendships are tested and secrets come to the surface when terminally single Rachel falls for Dex, her best friend Darcy's fiancé.",English,United States,5 nominations,https://m.media-amazon.com/images/M/MV5BNzczNzMzODk0Nl5BMl5BanBnXkFtZTcwMjgwMjI0NA@@._V1_SX300.jpg,"[{'Source': 'Internet Movie Database', 'Value': '5.9/10'}, {'Source': 'Rotten Tomatoes', 'Value': '15%'}, {'Source': 'Metacritic', 'Value': '36/100'}]",36,5.9,"61,167",tt0491152,movie,16 Aug 2011,"$39,046,489",N/A,N/A,True,,
315,,,,,,,,,,,,,,,,,,,,,,,,,False,,Movie not found!
316,Priest,2011,PG-13,13 May 2011,87 min,"Action, Adventure, Fantasy",Scott Stewart,"Cory Goodman, Min-Woo Hyung","Paul Bettany, Cam Gigandet, Maggie Q",A priest disobeys church law to track down the vampires who kidnapped his niece.,English,United States,3 nominations,https://m.media-amazon.com/images/M/MV5BMTQ1MTAwODc3OV5BMl5BanBnXkFtZTcwNzI0MDQ3NA@@._V1_SX300.jpg,"[{'Source': 'Internet Movie Database', 'Value': '5.7/10'}, {'Source': 'Rotten Tomatoes', 'Value': '15%'}, {'Source': 'Metacritic', 'Value': '41/100'}]",41,5.7,"118,568",tt0822847,movie,16 Aug 2011,"$29,137,000",N/A,N/A,True,,
317,Johnny English Reborn,2011,PG,21 Oct 2011,101 min,"Action, Adventure, Comedy",Oliver Parker,"Hamish McColl, William Davies, Neal Purvis","Rowan Atkinson, Rosamund Pike, Dominic West",Johnny English goes up against international assassins hunting down Chinese Premier Xiang Ping.,"English, Mandarin, Swiss German, Cantonese, Russian","United Kingdom, France, United States",4 nominations,https://m.media-amazon.com/images/M/MV5BMjEzODY2MjU1Nl5BMl5BanBnXkFtZTcwMzc1ODUzNg@@._V1_SX300.jpg,"[{'Source': 'Internet Movie Database', 'Value': '6.3/10'}, {'Source': 'Rotten Tomatoes', 'Value': '38%'}, {'Source': 'Metacritic', 'Value': '46/100'}]",46,6.3,"126,993",tt1634122,movie,14 Feb 2012,"$8,305,970",N/A,N/A,True,,
318,The Inbetweeners,2008–2010,TV-14,25 Jan 2010,25 min,Comedy,N/A,N/A,"Simon Bird, James Buckley, Blake Harrison",Follows four friends and their antics during their final years of school.,English,United Kingdom,Won 1 BAFTA Film Award13 wins & 14 nominations total,https://m.media-amazon.com/images/M/MV5BMmFlZjEyZjItODJkZS00MWU3LTg0MDMtZjRiYTFhNDE4ODRjXkEyXkFqcGdeQXVyODE5NzE3OTE@._V1_SX300.jpg,"[{'Source': 'Internet Movie Database', 'Value': '8.4/10'}]",N/A,8.4,"84,775",tt1220617,series,,,,,True,3,
319,Bucky Larson: Born to Be a Star,2011,R,09 Sep 2011,97 min,Comedy,Tom Brady,"Adam Sandler, Allen Covert, Nick Swardson","Nick Swardson, Don Johnson, Christina Ricci","A kid from the Midwest moves out to Hollywood in order to follow in his parents footsteps, and become a porn star.",English,United States,1 win & 6 nominations,https://m.media-amazon.com/images/M/MV5BMjIzMjY4MTk2M15BMl5BanBnXkFtZTcwNzQ3ODg3NQ@@._V1_SX300.jpg,"[{'Source': 'Internet Movie Database', 'Value': '3.2/10'}, {'Source': 'Rotten Tomatoes', 'Value': '3%'}, {'Source': 'Metacritic', 'Value': '9/100'}]",9,3.2,"11,895",tt1411664,movie,17 Jan 2012,"$2,529,395",N/A,N/A,True,,
320,Diary of a Wimpy Kid: Rodrick Rules,2011,PG,25 Mar 2011,99 min,"Comedy, Family",David Bowers,"Gabe Sachs, Jeff Judah, Jeff Kinney","Zachary Gordon, Devon Bostick, Robert Capron","Back in middle school after summer vacation, Greg Heffley and his older brother Rodrick must deal with their parents' misguided attempts to have them bond.",English,United States,2 wins & 5 nominations,https://m.media-amazon.com/images/M/MV5BMTcxNDYwOTEzMl5BMl5BanBnXkFtZTcwOTA3MzY3NA@@._V1_SX300.jpg,"[{'Source': 'Internet Movie Database', 'Value': '6.6/10'}, {'Source': 'Rotten Tomatoes', 'Value': '47%'}, {'Source': 'Metacritic', 'Value': '51/100'}]",51,6.6,"29,651",tt1650043,movie,11 Jun 2011,"$52,698,535",N/A,N/A,True,,
