,Title,Year,Rated,Released,Runtime,Genre,Director,Writer,Actors,Plot,Language,Country,Awards,Poster,Ratings,Metascore,imdbRating,imdbVotes,imdbID,Type,DVD,BoxOffice,Production,Website,Response,totalSeasons,Error
105,Valentine's Day,2010,PG-13,12 Feb 2010,125 min,"Comedy, Romance",Garry Marshall,"Katherine Fugate, Abby Kohn, Marc Silverstein","Julia Roberts, Jamie Foxx, Anne Hathaway",Intertwining couples and singles in Los Angeles break-up and make-up based on the pressures and expectations of Valentine's Day.,"English, Spanish, Russian, Italian",United States,7 wins & 12 nominations,https://m.media-amazon.com/images/M/MV5BMTk3MTIwNDIxNF5BMl5BanBnXkFtZTcwMDMyMzcwMw@@._V1_SX300.jpg,"[{'Source': 'Internet Movie Database', 'Value': '5.7/10'}, {'Source': 'Rotten Tomatoes', 'Value': '18%'}, {'Source': 'Metacritic', 'Value': '34/100'}]",34,5.7,"117,725",tt0817230,movie,18 May 2010,"$110,485,654",N/A,N/A,True,,
106,Letters to Juliet,2010,PG,14 May 2010,105 min,"Adventure, Comedy, Drama",Gary Winick,"Jose Rivera, Tim Sullivan","Amanda Seyfried, Gael García Bernal, Vanessa Redgrave","Sophie dreams of becoming a writer and travels to Verona, Italy where she meets the ""Secretaries of Juliet"".","English, Italian, Spanish",United States,6 nominations,https://m.media-amazon.com/images/M/MV5BMjg0OTU0NDYwNF5BMl5BanBnXkFtZTcwNzUwNTMyMw@@._V1_SX300.jpg,"[{'Source': 'Internet Movie Database', 'Value': '6.5/10'}, {'Source': 'Rotten Tomatoes', 'Value': '42%'}, {'Source': 'Metacritic', 'Value': '50/100'}]",50,6.5,"97,627",tt0892318,movie,14 Sep 2010,"$53,032,453",N/A,N/A,True,,
107,Dear John,2010,PG-13,05 Feb 2010,108 min,"Drama, Mystery, Romance",Lasse Hallström,"Jamie Linden, Nicholas Sparks","Channing Tatum, Amanda Seyfried, Richard Jenkins",A romantic drama about a soldier who falls for a conservative college student while he's home on leave.,English,United States,4 wins & 8 nominations,https://m.media-amazon.com/images/M/MV5BMTk1NDEzMTU5NV5BMl5BanBnXkFtZTcwNTI3MTk5Mg@@._V1_SX300.jpg,"[{'Source': 'Internet Movie Database', 'Value': '6.3/10'}, {'Source': 'Rotten Tomatoes', 'Value': '28%'}, {'Source': 'Metacritic', 'Value': '43/100'}]",43,6.3,"145,382",tt0989757,movie,25 May 2010,"$80,014,842",N/A,N/A,True,,
108,Get Him to the Greek,2010,R,04 Jun 2010,109 min,"Comedy, Music",Nicholas Stoller,"Nicholas Stoller, Jason Segel","Jonah Hill, Russell Brand, Elisabeth Moss",A record company intern is hired to accompany out-of-control British rock star Aldous Snow to a concert at L.A.'s Greek Theater.,English,United States,14 nominations,https://m.media-amazon.com/images/M/MV5BMjIyMzQ0MjExNV5BMl5BanBnXkFtZTcwMzkyMzgxMw@@._V1_SX300.jpg,"[{'Source': 'Internet Movie Database', 'Value': '6.3/10'}, {'Source': 'Rotten Tomatoes', 'Value': '72%'}, {'Source': 'Metacritic', 'Value': '65/100'}]",65,6.3,"175,345",tt1226229,movie,28 Sep 2010,"$60,974,475",N/A,N/A,True,,
109,Dinner for Schmucks,2010,PG-13,30 Jul 2010,114 min,Comedy,Jay Roach,"David Guion, Michael Handelman, Francis Veber","Steve Carell, Paul Rudd, Stephanie Szostak","After he finds out that his work superiors host a dinner celebrating the idiocy of their special guests, a rising executive questions the merits of his invitation just as he befriends a man who would be the perfect guest.",English,United States,1 nomination,https://m.media-amazon.com/images/M/MV5BOTk5MTYzNTIyMl5BMl5BanBnXkFtZTcwOTM3MTQ2Mw@@._V1_SX300.jpg,"[{'Source': 'Internet Movie Database', 'Value': '5.9/10'}, {'Source': 'Rotten Tomatoes', 'Value': '42%'}, {'Source': 'Metacritic', 'Value': '56/100'}]",56,5.9,"104,912",tt0427152,movie,04 Jan 2011,"$73,026,337",N/A,N/A,True,,
110,How Do You Know,2010,PG-13,17 Dec 2010,121 min,"Comedy, Drama, Romance",James L. Brooks,James L. Brooks,"Reese Witherspoon, Paul Rudd, Owen Wilson","After being cut from the U.S.A. softball team and feeling a bit past her prime, Lisa finds herself evaluating her life and in the middle of a love triangle, as a corporate guy in crisis competes with her current, baseball-playing bea",English,United States,3 nominations,https://m.media-amazon.com/images/M/MV5BOTQyMzU4OTk1N15BMl5BanBnXkFtZTcwNTE5MTUxNA@@._V1_SX300.jpg,"[{'Source': 'Internet Movie Database', 'Value': '5.4/10'}, {'Source': 'Rotten Tomatoes', 'Value': '31%'}, {'Source': 'Metacritic', 'Value': '46/100'}]",46,5.4,"49,013",tt1341188,movie,22 Mar 2011,"$30,212,620",N/A,N/A,True,,
111,The Secret World of Arrietty,2010,G,17 Feb 2012,94 min,"Animation, Adventure, Drama",Hiromasa Yonebayashi,"Mary Norton, Hayao Miyazaki, Keiko Niwa","Amy Poehler, Will Arnett, Mirai Shida","The Clock family are four-inch-tall people who live anonymously in another family's residence, borrowing simple items to make their home. Life changes for the Clocks when their teenage daughter, Arrietty, is discovered.",Japanese,Japan,12 wins & 6 nominations,https://m.media-amazon.com/images/M/MV5BZDY3ZGI0ZDAtMThlNy00MzAxLTg4YjAtNjkwYTkxNmQ4MjdlXkEyXkFqcGdeQXVyMTMxODk2OTU@._V1_SX300.jpg,"[{'Source': 'Internet Movie Database', 'Value': '7.6/10'}, {'Source': 'Rotten Tomatoes', 'Value': '95%'}, {'Source': 'Metacritic', 'Value': '80/100'}]",80,7.6,"88,422",tt1568921,movie,22 May 2012,"$19,587,032",N/A,N/A,True,,
112,Gulliver's Travels,2010,PG,25 Dec 2010,85 min,"Adventure, Comedy, Family",Rob Letterman,"Joe Stillman, Nicholas Stoller, Jonathan Swift","Jack Black, Emily Blunt, Jason Segel","Travel writer Lemuel Gulliver takes an assignment in Bermuda but ends up on the island of Lilliput, where he towers over its tiny citizens.",English,United States,3 nominations,https://m.media-amazon.com/images/M/MV5BMTU0NTUwOTM3Nl5BMl5BanBnXkFtZTcwMDA3NjIwNA@@._V1_SX300.jpg,"[{'Source': 'Internet Movie Database', 'Value': '4.9/10'}, {'Source': 'Rotten Tomatoes', 'Value': '20%'}, {'Source': 'Metacritic', 'Value': '33/100'}]",33,4.9,"68,464",tt1320261,movie,19 Apr 2011,"$42,779,261",N/A,N/A,True,,
113,Submarine,2010,R,18 Mar 2011,97 min,"Comedy, Drama, Romance",Richard Ayoade,"Richard Ayoade, Joe Dunthorne","Craig Roberts, Sally Hawkins, Paddy Considine","15-year-old Oliver Tate has two objectives: To lose his virginity before his next birthday, and to extinguish the flame between his mother and an ex-lover who has resurfaced in her life.",English,"United Kingdom, United States",Nominated for 1 BAFTA Film Award6 wins & 17 nominations total,https://m.media-amazon.com/images/M/MV5BMTQ5ODMxNTIyNV5BMl5BanBnXkFtZTcwNjQ1ODgyNQ@@._V1_SX300.jpg,"[{'Source': 'Internet Movie Database', 'Value': '7.3/10'}, {'Source': 'Rotten Tomatoes', 'Value': '88%'}, {'Source': 'Metacritic', 'Value': '76/100'}]",76,7.3,"89,074",tt1440292,movie,04 Oct 2011,"$467,602",N/A,N/A,True,,
114,Tooth Fairy,2010,PG,22 Jan 2010,101 min,"Comedy, Family, Fantasy",Michael Lembeck,"Lowell Ganz, Babaloo Mandel, Joshua Sternin","Dwayne Johnson, Ashley Judd, Julie Andrews",A bad deed on the part of a tough minor-league hockey player results in an unusual sentence: He must serve one week as a real-life tooth fairy.,English,"United States, Canada",1 win & 4 nominations,https://m.media-amazon.com/images/M/MV5BMTQ4NjQzMjQxNF5BMl5BanBnXkFtZTcwNTEzMDY4Mg@@._V1_SX300.jpg,"[{'Source': 'Internet Movie Database', 'Value': '5.0/10'}, {'Source': 'Rotten Tomatoes', 'Value': '17%'}, {'Source': 'Metacritic', 'Value': '36/100'}]",36,5.0,"45,007",tt0808510,movie,04 May 2010,"$60,022,256",N/A,N/A,True,,
115,The Switch,2010,PG-13,20 Aug 2010,101 min,"Comedy, Drama, Romance","Josh Gordon, Will Speck","Jeffrey Eugenides, Allan Loeb","Jennifer Aniston, Jason Bateman, Patrick Wilson","Seven years after the fact, a man comes to the realization that he was the sperm donor for his best friend's boy.",English,United States,1 win & 3 nominations,https://m.media-amazon.com/images/M/MV5BODQ5ODc0MjU1N15BMl5BanBnXkFtZTcwMTc3NzcyMw@@._V1_SX300.jpg,"[{'Source': 'Internet Movie Database', 'Value': '6.1/10'}, {'Source': 'Rotten Tomatoes', 'Value': '52%'}, {'Source': 'Metacritic', 'Value': '52/100'}]",52,6.1,"102,706",tt0889573,movie,21 Dec 2010,"$27,779,426",N/A,N/A,True,,
116,Step Up,2006,PG-13,11 Aug 2006,104 min,"Crime, Drama, Music",Anne Fletcher,"Duane Adler, Melissa Rosenberg","Channing Tatum, Jenna Dewan, Damaine Radcliff","Tyler Gage receives the opportunity of a lifetime after vandalizing a performing arts school, gaining him the chance to earn a scholarship and dance with an up and coming dancer, Nora.",English,United States,1 win & 3 nominations,https://m.media-amazon.com/images/M/MV5BODEzMzVhODgtOTc1NS00MmY3LWI3OGUtN2ZjNDEwM2ExZjJlXkEyXkFqcGdeQXVyNjk1Njg5NTA@._V1_SX300.jpg,"[{'Source': 'Internet Movie Database', 'Value': '6.5/10'}, {'Source': 'Rotten Tomatoes', 'Value': '21%'}, {'Source': 'Metacritic', 'Value': '48/100'}]",48,6.5,"115,738",tt0462590,movie,19 Dec 2006,"$65,328,121",N/A,N/A,True,,
117,The Way,2010,PG-13,19 Nov 2010,123 min,"Comedy, Drama",Emilio Estevez,"Emilio Estevez, Jack Hitt","Martin Sheen, Emilio Estevez, Deborah Kara Unger","A father heads overseas to recover the body of his estranged son who died while traveling the ""El camino de Santiago,"" and decides to take the pilgrimage himself.","English, Spanish, French, Catalan, Italian","Spain, United States",1 win & 8 nominations,https://m.media-amazon.com/images/M/MV5BMTU4MzM4NzkyOF5BMl5BanBnXkFtZTcwMjQwNjMzNg@@._V1_SX300.jpg,"[{'Source': 'Internet Movie Database', 'Value': '7.4/10'}, {'Source': 'Rotten Tomatoes', 'Value': '83%'}, {'Source': 'Metacritic', 'Value': '64/100'}]",64,7.4,"32,105",tt1441912,movie,28 Apr 2009,"$4,430,765",N/A,N/A,True,,
118,Elektra Luxx,2010,R,14 Mar 2010,100 min,"Comedy, Drama",Sebastian Gutierrez,Sebastian Gutierrez,"Joseph Gordon-Levitt, Carla Gugino, Ermahn Ospina",Life for porn actress Elektra Luxx gets turned upside down when she finds out she's pregnant.,English,United States,1 nomination,https://m.media-amazon.com/images/M/MV5BMTM0MDU1MjkyMF5BMl5BanBnXkFtZTcwNDQ5MDA1NA@@._V1_SX300.jpg,"[{'Source': 'Internet Movie Database', 'Value': '5.1/10'}, {'Source': 'Rotten Tomatoes', 'Value': '24%'}, {'Source': 'Metacritic', 'Value': '50/100'}]",50,5.1,"7,230",tt1340773,movie,21 Jun 2011,"$11,514",N/A,N/A,True,,
119,Black Death,2010,R,11 Jun 2010,102 min,"Action, Drama, History",Christopher Smith,"Dario Poloni, Christopher Smith","Eddie Redmayne, Sean Bean, Carice van Houten","Set during the time of the first outbreak of bubonic plague in England, a young monk is given the task of learning the truth about reports of people being brought back to life in a small village.","English, Latin","Germany, United Kingdom",3 wins & 7 nominations,https://m.media-amazon.com/images/M/MV5BMTkxNjEwNjY3NV5BMl5BanBnXkFtZTcwMTY1NTUyNA@@._V1_SX300.jpg,"[{'Source': 'Internet Movie Database', 'Value': '6.4/10'}, {'Source': 'Rotten Tomatoes', 'Value': '71%'}, {'Source': 'Metacritic', 'Value': '71/100'}]",71,6.4,"47,184",tt1181791,movie,10 May 2011,"$22,554",N/A,N/A,True,,
120,Certified Copy,2010,Not Rated,25 Mar 2011,106 min,"Drama, Romance",Abbas Kiarostami,"Abbas Kiarostami, Caroline Eliacheff","Juliette Binoche, William Shimell, Jean-Claude Carrière","In Tuscany to promote his latest book, a middle-aged British writer meets a French woman who leads him to the village of Lucignano. While there, a chance question reveals something deeper.","French, English, Italian","France, Italy, Belgium, Iran",10 wins & 28 nominations,https://m.media-amazon.com/images/M/MV5BYWE3OWVlYzAtMzBhNS00ZWY4LWJkYzgtNGZhY2Q2MGVlYzBiXkEyXkFqcGdeQXVyODU4MzMxNDg@._V1_SX300.jpg,"[{'Source': 'Internet Movie Database', 'Value': '7.3/10'}, {'Source': 'Rotten Tomatoes', 'Value': '89%'}, {'Source': 'Metacritic', 'Value': '82/100'}]",82,7.3,"23,685",tt1020773,movie,06 Sep 2011,"$1,373,975",N/A,N/A,True,,
121,Wall Street: Money Never Sleeps,2010,PG-13,24 Sep 2010,133 min,Drama,Oliver Stone,"Allan Loeb, Stephen Schiff, Stanley Weiser","Shia LaBeouf, Michael Douglas, Carey Mulligan","Now out of prison but still disgraced by his peers, Gordon Gekko works his future son-in-law, an idealistic stock broker, when he sees an opportunity to take down a Wall Street enemy and rebuild his empire.",English,United States,1 win & 4 nominations,https://m.media-amazon.com/images/M/MV5BMTU5MDEzMzYwMF5BMl5BanBnXkFtZTcwNTcwMjUxMw@@._V1_SX300.jpg,"[{'Source': 'Internet Movie Database', 'Value': '6.2/10'}, {'Source': 'Rotten Tomatoes', 'Value': '55%'}, {'Source': 'Metacritic', 'Value': '59/100'}]",59,6.2,"101,262",tt1027718,movie,21 Dec 2010,"$52,474,616",N/A,N/A,True,,
122,The Last Song,2010,PG,31 Mar 2010,107 min,"Drama, Music, Romance",Julie Anne Robinson,"Nicholas Sparks, Jeff Van Wie","Miley Cyrus, Liam Hemsworth, Greg Kinnear","A rebellious girl is sent to a Southern beach town for the summer to stay with her father. Through their mutual love of music, the estranged duo learn to reconnect.",English,United States,4 wins & 10 nominations,https://m.media-amazon.com/images/M/MV5BMjE2MTcyMjMyNF5BMl5BanBnXkFtZTgwODg2ODU1MDE@._V1_SX300.jpg,"[{'Source': 'Internet Movie Database', 'Value': '6.0/10'}, {'Source': 'Rotten Tomatoes', 'Value': '20%'}, {'Source': 'Metacritic', 'Value': '33/100'}]",33,6.0,"85,674",tt1294226,movie,17 Aug 2010,"$62,950,384",N/A,N/A,True,,
123,Cop Out,2010,R,26 Feb 2010,107 min,"Action, Comedy, Crime",Kevin Smith,"Robb Cullen, Mark Cullen","Bruce Willis, Tracy Morgan, Juan Carlos Hernández","Jimmy's rare baseball card is robbed. Since it's his only hope to pay for his daughter's upcoming wedding, he recruits his cop partner Paul to track down the robber, a memorabilia-obsessed gangster.","English, Spanish",United States,1 nomination,https://m.media-amazon.com/images/M/MV5BMTk0NzcxMjYwNF5BMl5BanBnXkFtZTcwMTI4MTIxMw@@._V1_SX300.jpg,"[{'Source': 'Internet Movie Database', 'Value': '5.6/10'}, {'Source': 'Rotten Tomatoes', 'Value': '19%'}, {'Source': 'Metacritic', 'Value': '31/100'}]",31,5.6,"87,191",tt1385867,movie,20 Jul 2010,"$44,875,481",N/A,N/A,True,,
124,Rubber,2010,R,10 Nov 2010,82 min,"Comedy, Fantasy, Horror",Quentin Dupieux,Quentin Dupieux,"Stephen Spinella, Roxane Mesquida, Wings Hauser","A homicidal car tire, discovering it has destructive psionic power, sets its sights on a desert town once a mysterious woman becomes its obsession.",English,France,5 wins & 3 nominations,https://m.media-amazon.com/images/M/MV5BZTY2NTY4MzctMWNkYy00NWM4LTliOWQtMWExZDU1ZWQxNTQxXkEyXkFqcGdeQXVyNTIzOTk5ODM@._V1_SX300.jpg,"[{'Source': 'Internet Movie Database', 'Value': '5.8/10'}, {'Source': 'Rotten Tomatoes', 'Value': '68%'}, {'Source': 'Metacritic', 'Value': '59/100'}]",59,5.8,"36,140",tt1612774,movie,07 Jun 2011,"$100,370",N/A,N/A,True,,
125,Biutiful,2010,R,04 Feb 2011,148 min,"Drama, Romance",Alejandro G. Iñárritu,"Alejandro G. Iñárritu, Armando Bo, Nicolás Giacobone","Javier Bardem, Maricel Álvarez, Hanaa Bouchaib",A man dying of cancer tries his best to leave the world on his own terms.,"Spanish, Chinese, Wolof","Mexico, Spain",Nominated for 2 Oscars. 21 wins & 65 nominations total,https://m.media-amazon.com/images/M/MV5BMzI4OTQ0MDQyNl5BMl5BanBnXkFtZTcwODY5MjQwNA@@._V1_SX300.jpg,"[{'Source': 'Internet Movie Database', 'Value': '7.5/10'}, {'Source': 'Rotten Tomatoes', 'Value': '66%'}, {'Source': 'Metacritic', 'Value': '58/100'}]",58,7.5,"89,282",tt1164999,movie,27 Nov 2001,"$5,101,237",N/A,N/A,True,,
126,You Again,2010,PG,24 Sep 2010,105 min,"Comedy, Romance",Andy Fickman,Moe Jelline,"Kristen Bell, Odette Annable, Sigourney Weaver","When a young woman realizes her brother is about to marry the girl who bullied her in high school, she sets out to expose the fiancée's true colors.","English, French, German, Spanish, Hawaiian, Japanese, Italian, Hebrew",United States,2 wins,https://m.media-amazon.com/images/M/MV5BMTM5MzkyMDY0MV5BMl5BanBnXkFtZTcwNDkxNDc1Mw@@._V1_SX300.jpg,"[{'Source': 'Internet Movie Database', 'Value': '5.8/10'}, {'Source': 'Rotten Tomatoes', 'Value': '19%'}, {'Source': 'Metacritic', 'Value': '28/100'}]",28,5.8,"50,801",tt1414382,movie,08 Feb 2011,"$25,702,053",N/A,N/A,True,,
127,The Bounty Hunter,2010,PG-13,19 Mar 2010,110 min,"Action, Comedy, Romance",Andy Tennant,Sarah Thorp,"Jennifer Aniston, Gerard Butler, Gio Perez","A bounty hunter learns that his next target is his ex-wife, a reporter working on a murder cover-up. Soon after their reunion, the always-at-odds duo find themselves on a run-for-their-lives adventure.","English, Ukrainian",United States,4 wins & 5 nominations,https://m.media-amazon.com/images/M/MV5BMTUwNjY4MjY0MV5BMl5BanBnXkFtZTcwNTA2OTYwMw@@._V1_SX300.jpg,"[{'Source': 'Internet Movie Database', 'Value': '5.6/10'}, {'Source': 'Rotten Tomatoes', 'Value': '12%'}, {'Source': 'Metacritic', 'Value': '22/100'}]",22,5.6,"125,518",tt1038919,movie,13 Jul 2010,"$67,061,228",N/A,N/A,True,,
128,From Paris with Love,2010,R,05 Feb 2010,92 min,"Action, Crime, Thriller",Pierre Morel,"Adi Hasak, Luc Besson","John Travolta, Jonathan Rhys Meyers, Kasia Smutniak","In Paris, a young employee in the office of the US Ambassador hooks up with an American spy looking to stop a terrorist attack in the city.","English, French, Mandarin, German","France, United Kingdom, United States",N/A,https://m.media-amazon.com/images/M/MV5BODAwMDFjNjktMWY2Mi00MmVhLWI0MjYtNzg4OTI0NzA5YzBjXkEyXkFqcGdeQXVyNTIzOTk5ODM@._V1_SX300.jpg,"[{'Source': 'Internet Movie Database', 'Value': '6.4/10'}, {'Source': 'Rotten Tomatoes', 'Value': '38%'}, {'Source': 'Metacritic', 'Value': '42/100'}]",42,6.4,"115,617",tt1179034,movie,08 Jun 2010,"$24,077,427",N/A,N/A,True,,
129,13 Assassins,2010,R,25 Sep 2010,141 min,"Action, Adventure, Drama",Takashi Miike,"Kaneo Ikegami, Shoichirou Ikemiya, Daisuke Tengan","Kôji Yakusho, Takayuki Yamada, Yûsuke Iseya",A group of assassins come together for a suicide mission to kill an evil lord.,Japanese,"Japan, United Kingdom",15 wins & 28 nominations,https://m.media-amazon.com/images/M/MV5BODg3MTYwODY3MF5BMl5BanBnXkFtZTcwMDk2MzYwNQ@@._V1_SX300.jpg,"[{'Source': 'Internet Movie Database', 'Value': '7.6/10'}, {'Source': 'Rotten Tomatoes', 'Value': '95%'}, {'Source': 'Metacritic', 'Value': '84/100'}]",84,7.6,"64,323",tt1436045,movie,05 Jul 2011,"$802,778",N/A,N/A,True,,
130,Nanny McPhee Returns,2010,PG,20 Aug 2010,109 min,"Comedy, Family, Fantasy",Susanna White,"Emma Thompson, Christianna Brand","Emma Thompson, Maggie Gyllenhaal, Ralph Fiennes","Nanny McPhee arrives to help a harried young mother who is trying to run the family farm while her husband is away at war, though she uses her magic to teach the woman's children and their two spoiled cousins five new lessons.",English,"United Kingdom, France, United States",1 win & 2 nominations,https://m.media-amazon.com/images/M/MV5BMTI5NDUxNDU4OF5BMl5BanBnXkFtZTcwNDk1NjM1Mw@@._V1_SX300.jpg,"[{'Source': 'Internet Movie Database', 'Value': '6.1/10'}, {'Source': 'Rotten Tomatoes', 'Value': '75%'}, {'Source': 'Metacritic', 'Value': '52/100'}]",52,6.1,"31,475",tt1415283,movie,14 Dec 2010,"$29,011,215",N/A,N/A,True,,
131,All Good Things,2010,R,03 Dec 2010,101 min,"Crime, Drama, Mystery",Andrew Jarecki,"Marcus Hinchey, Marc Smerling","Ryan Gosling, Kirsten Dunst, Frank Langella","Mr. David Marks was suspected but never tried for killing his wife Katie who disappeared in 1982, but the truth is eventually revealed.",English,United States,1 nomination,https://m.media-amazon.com/images/M/MV5BMTcwMjIyMTc2Nl5BMl5BanBnXkFtZTcwOTQyMzc5Mw@@._V1_SX300.jpg,"[{'Source': 'Internet Movie Database', 'Value': '6.3/10'}, {'Source': 'Rotten Tomatoes', 'Value': '35%'}, {'Source': 'Metacritic', 'Value': '57/100'}]",57,6.3,"55,165",tt1175709,movie,29 Mar 2011,"$582,024",N/A,N/A,True,,
132,Wild Target,2010,PG-13,18 Jun 2010,98 min,"Action, Comedy, Crime",Jonathan Lynn,"Lucinda Coxon, Pierre Salvadori","Bill Nighy, Emily Blunt, Rupert Grint","A hitman tries to retire, but a beautiful thief may change his plans.","English, French","United Kingdom, France",N/A,https://m.media-amazon.com/images/M/MV5BYzM4NzFmMDktMzJiYS00OWU0LWFkZjEtM2ZhNzg0NzU3ZTUwXkEyXkFqcGdeQXVyNzQ5MzY0NjM@._V1_SX300.jpg,"[{'Source': 'Internet Movie Database', 'Value': '6.8/10'}, {'Source': 'Rotten Tomatoes', 'Value': '33%'}, {'Source': 'Metacritic', 'Value': '41/100'}]",41,6.8,"37,662",tt1235189,movie,08 Feb 2011,"$108,589",N/A,N/A,True,,
133,When in Rome,2010,PG-13,29 Jan 2010,91 min,"Comedy, Romance",Mark Steven Johnson,"David Diamond, David Weissman","Kristen Bell, Josh Duhamel, Anjelica Huston","Beth is a young, ambitious New Yorker who is completely unlucky in love. However, on a whirlwind trip to Rome, she impulsively steals some coins from a reputed fountain of love, and is then aggressively pursued by a band of suitors.","English, Italian, Ukrainian",United States,3 nominations,https://m.media-amazon.com/images/M/MV5BMTM0OTQ3MjgzN15BMl5BanBnXkFtZTcwMjMyNzg3Mg@@._V1_SX300.jpg,"[{'Source': 'Internet Movie Database', 'Value': '5.6/10'}, {'Source': 'Rotten Tomatoes', 'Value': '17%'}, {'Source': 'Metacritic', 'Value': '25/100'}]",25,5.6,"61,347",tt1185416,movie,15 Jun 2010,"$32,680,633",N/A,N/A,True,,
134,Going the Distance,2010,R,03 Sep 2010,102 min,"Comedy, Romance",Nanette Burstein,Geoff LaTulippe,"Drew Barrymore, Justin Long, Ron Livingston",A romantic comedy centered on a guy and a gal who try to keep their love alive as they shuttle back and forth between New York and San Francisco to see one another.,English,United States,N/A,https://m.media-amazon.com/images/M/MV5BMjQ1ODUyMjk5N15BMl5BanBnXkFtZTcwMjAxOTE2Mw@@._V1_SX300.jpg,"[{'Source': 'Internet Movie Database', 'Value': '6.3/10'}, {'Source': 'Rotten Tomatoes', 'Value': '54%'}, {'Source': 'Metacritic', 'Value': '51/100'}]",51,6.3,"57,896",tt1322312,movie,30 Nov 2010,"$17,804,299",N/A,N/A,True,,
135,Somewhere,2010,R,21 Jan 2011,97 min,"Comedy, Drama",Sofia Coppola,Sofia Coppola,"Stephen Dorff, Elle Fanning, Chris Pontius","After withdrawing to the Chateau Marmont, a passionless Hollywood actor reexamines his life when his eleven-year-old daughter surprises him with a visit.","English, Italian","United States, United Kingdom, Italy, Japan",4 wins & 8 nominations,https://m.media-amazon.com/images/M/MV5BMTg1MzE1NDA0M15BMl5BanBnXkFtZTcwODM2MDY1Mw@@._V1_SX300.jpg,"[{'Source': 'Internet Movie Database', 'Value': '6.3/10'}, {'Source': 'Rotten Tomatoes', 'Value': '70%'}, {'Source': 'Metacritic', 'Value': '67/100'}]",67,6.3,"44,387",tt1421051,movie,19 Apr 2011,"$1,785,645",N/A,N/A,True,,
136,Secretariat,2010,PG,08 Oct 2010,123 min,"Biography, Drama, Family",Randall Wallace,"Mike Rich, William Nack","Diane Lane, John Malkovich, Margo Martindale","Penny Chenery Tweedy and colleagues guide her long-shot but precocious stallion to set, in 1973, the unbeaten record for winning the Triple Crown.",English,United States,3 wins & 6 nominations,https://m.media-amazon.com/images/M/MV5BMTgwNDkyMDU3NV5BMl5BanBnXkFtZTcwNjMyNjI4Mw@@._V1_SX300.jpg,"[{'Source': 'Internet Movie Database', 'Value': '7.2/10'}, {'Source': 'Rotten Tomatoes', 'Value': '64%'}, {'Source': 'Metacritic', 'Value': '61/100'}]",61,7.2,"27,901",tt1028576,movie,25 Jan 2011,"$59,713,955",N/A,N/A,True,,
137,Ip Man 2,2010,R,29 Apr 2010,108 min,"Action, Biography, Drama",Wilson Yip,"Tai-lee Chan, Hiu-Yan Choi, Edmond Wong","Donnie Yen, Xiaoming Huang, Sammo Kam-Bo Hung",Centering on Ip Man's migration to Hong Kong in 1949 as he attempts to propagate his discipline of Wing Chun martial arts.,"Cantonese, Chinese, English","Hong Kong, China",6 wins & 10 nominations,https://m.media-amazon.com/images/M/MV5BZWM2MTcyMDgtZTZkNS00NTg5LWIwNzEtMmY1Y2I1MTZjYTE0XkEyXkFqcGdeQXVyMTMxODk2OTU@._V1_SX300.jpg,"[{'Source': 'Internet Movie Database', 'Value': '7.5/10'}, {'Source': 'Rotten Tomatoes', 'Value': '97%'}, {'Source': 'Metacritic', 'Value': '67/100'}]",67,7.5,"102,726",tt1386932,movie,19 Apr 2011,"$205,675",N/A,N/A,True,,
138,Death at a Funeral,2007,R,07 Sep 2007,90 min,Comedy,Frank Oz,Dean Craig,"Matthew Macfadyen, Peter Dinklage, Ewen Bremner",Chaos ensues when a man tries to expose a dark secret regarding a recently deceased patriarch of a dysfunctional British family.,English,"United States, Germany, United Kingdom, Netherlands",3 wins & 2 nominations,https://m.media-amazon.com/images/M/MV5BMjE4OTIyNTM1MF5BMl5BanBnXkFtZTcwMjUzNTg0MQ@@._V1_SX300.jpg,"[{'Source': 'Internet Movie Database', 'Value': '7.4/10'}, {'Source': 'Metacritic', 'Value': '67/100'}]",67,7.4,"113,695",tt0795368,movie,N/A,"$8,580,428",N/A,N/A,True,,
139,The Spy Next Door,2010,PG,15 Jan 2010,94 min,"Action, Comedy, Family",Brian Levant,"Jonathan Bernstein, James Greer, Gregory Poirier","Jackie Chan, Amber Valletta, Billy Ray Cyrus","Former C.I.A. spy Bob Ho takes on his toughest assignment to date: looking after his girlfriend's three kids, who haven't exactly warmed to their mom's beau.","English, Chinese, Russian",United States,2 nominations,https://m.media-amazon.com/images/M/MV5BMTI5MjEzMjM4N15BMl5BanBnXkFtZTcwODc0ODEwMw@@._V1_SX300.jpg,"[{'Source': 'Internet Movie Database', 'Value': '5.5/10'}, {'Source': 'Rotten Tomatoes', 'Value': '12%'}, {'Source': 'Metacritic', 'Value': '27/100'}]",27,5.5,"42,973",tt1273678,movie,18 May 2010,"$24,307,086",N/A,N/A,True,,
140,Hereafter,2010,PG-13,22 Oct 2010,129 min,"Drama, Fantasy, Romance",Clint Eastwood,Peter Morgan,"Matt Damon, Cécile de France, Bryce Dallas Howard","A drama centered on three people - a blue-collar American, a French journalist and a London school boy - who are touched by death in different ways.","English, French, German",United States,Nominated for 1 Oscar. 4 wins & 15 nominations total,https://m.media-amazon.com/images/M/MV5BMjE2MzU3Nzk4M15BMl5BanBnXkFtZTcwODcxNTI5Mw@@._V1_SX300.jpg,"[{'Source': 'Internet Movie Database', 'Value': '6.4/10'}, {'Source': 'Rotten Tomatoes', 'Value': '47%'}, {'Source': 'Metacritic', 'Value': '56/100'}]",56,6.4,"92,201",tt1212419,movie,15 Mar 2011,"$32,746,941",N/A,N/A,True,,
