,Title,Year,Rated,Released,Runtime,Genre,Director,Writer,Actors,Plot,Language,Country,Awards,Poster,Ratings,Metascore,imdbRating,imdbVotes,imdbID,Type,DVD,BoxOffice,Production,Website,Response,totalSeasons
69,Honeymoon,2014,R,12 Sep 2014,87 min,"Drama, Fantasy, Horror",Leigh Janiak,"Phil Graziadei, Leigh Janiak","Rose Leslie, Harry Treadaway, Ben Huber",A newlywed couple finds their lake-country honeymoon descend into chaos after Paul finds Bea wandering and disoriented in the middle of the night.,English,United States,5 nominations,https://m.media-amazon.com/images/M/MV5BMjI2MzA0NTk2NF5BMl5BanBnXkFtZTgwMzk2Njc0MjE@._V1_SX300.jpg,"[{'Source': 'Internet Movie Database', 'Value': '5.7/10'}, {'Source': 'Rotten Tomatoes', 'Value': '76%'}, {'Source': 'Metacritic', 'Value': '65/100'}]",65,5.7,"25,292",tt3177316,movie,13 Jan 2015,"$9,318",N/A,N/A,True,
70,Dumb and Dumber To,2014,PG-13,14 Nov 2014,109 min,Comedy,"Bobby Farrelly, Peter Farrelly","Sean Anders, John Morris, Peter Farrelly","Jim Carrey, Jeff Daniels, Rob Riggle","20 years since their first adventure, Lloyd and Harry go on a road trip to find Harry's newly discovered daughter, who was given up for adoption.","English, Cantonese",United States,1 win & 7 nominations,https://m.media-amazon.com/images/M/MV5BMTYxMzA0MzAyMF5BMl5BanBnXkFtZTgwMjMyNjcwMjE@._V1_SX300.jpg,"[{'Source': 'Internet Movie Database', 'Value': '5.6/10'}, {'Source': 'Rotten Tomatoes', 'Value': '30%'}, {'Source': 'Metacritic', 'Value': '36/100'}]",36,5.6,"134,384",tt2096672,movie,17 Feb 2015,"$86,208,010",N/A,N/A,True,
71,Before We Go,2014,PG-13,21 Jul 2015,95 min,"Comedy, Drama, Romance",Chris Evans,"Ronald Bass, Jen Smolka, Chris Shafer","Chris Evans, Alice Eve, Emma Fitzpatrick",Two strangers stuck in Manhattan for the night grow into each other's most trusted confidants when an evening of unexpected adventure forces them to confront their fears and take control of their lives.,English,United States,N/A,https://m.media-amazon.com/images/M/MV5BOTMxNzE0NjY4NV5BMl5BanBnXkFtZTgwMjIxNjIzNjE@._V1_SX300.jpg,"[{'Source': 'Internet Movie Database', 'Value': '6.8/10'}, {'Source': 'Rotten Tomatoes', 'Value': '27%'}, {'Source': 'Metacritic', 'Value': '31/100'}]",31,6.8,"56,274",tt0443465,movie,03 Nov 2015,"$37,151",N/A,N/A,True,
72,How to Train Your Dragon 2,2014,PG,13 Jun 2014,102 min,"Animation, Action, Adventure",Dean DeBlois,"Dean DeBlois, Cressida Cowell","Jay Baruchel, Cate Blanchett, Gerard Butler","When Hiccup and Toothless discover an ice cave that is home to hundreds of new wild dragons and the mysterious Dragon Rider, the two friends find themselves at the center of a battle to protect the peace.",English,United States,Nominated for 1 Oscar. 15 wins & 61 nominations total,https://m.media-amazon.com/images/M/MV5BMzMwMTAwODczN15BMl5BanBnXkFtZTgwMDk2NDA4MTE@._V1_SX300.jpg,"[{'Source': 'Internet Movie Database', 'Value': '7.8/10'}, {'Source': 'Rotten Tomatoes', 'Value': '91%'}, {'Source': 'Metacritic', 'Value': '77/100'}]",77,7.8,"321,777",tt1646971,movie,11 Nov 2014,"$177,002,924",N/A,N/A,True,
73,Noah,2014,PG-13,28 Mar 2014,138 min,"Action, Adventure, Drama",Darren Aronofsky,"Darren Aronofsky, Ari Handel","Russell Crowe, Jennifer Connelly, Anthony Hopkins",Noah is chosen by God to undertake a momentous mission before an apocalyptic flood cleanses the world.,English,United States,1 win & 19 nominations,https://m.media-amazon.com/images/M/MV5BMjI2OTgyNTc0Ml5BMl5BanBnXkFtZTgwNDM1NTQxMTE@._V1_SX300.jpg,"[{'Source': 'Internet Movie Database', 'Value': '5.7/10'}, {'Source': 'Rotten Tomatoes', 'Value': '76%'}, {'Source': 'Metacritic', 'Value': '68/100'}]",68,5.7,"251,187",tt1959490,movie,29 Jul 2014,"$101,200,044",N/A,N/A,True,
74,A Walk Among the Tombstones,2014,R,19 Sep 2014,114 min,"Action, Crime, Drama",Scott Frank,"Lawrence Block, Scott Frank","Liam Neeson, Dan Stevens, David Harbour",Private investigator Matthew Scudder is hired by a drug kingpin to find out who kidnapped and murdered his wife.,"English, Spanish, Urdu, Russian",United States,1 nomination,https://m.media-amazon.com/images/M/MV5BMTQ3NzY2MTg1M15BMl5BanBnXkFtZTgwODY2Njk4MTE@._V1_SX300.jpg,"[{'Source': 'Internet Movie Database', 'Value': '6.5/10'}, {'Source': 'Rotten Tomatoes', 'Value': '68%'}, {'Source': 'Metacritic', 'Value': '57/100'}]",57,6.5,"117,637",tt0365907,movie,13 Jan 2015,"$26,307,600",N/A,N/A,True,
75,Need for Speed,2014,PG-13,14 Mar 2014,132 min,"Action, Crime, Thriller",Scott Waugh,"George Gatins, John Gatins","Aaron Paul, Dominic Cooper, Imogen Poots","Fresh from prison, a street racer who was framed by a wealthy business associate joins a cross-country race with revenge in mind. His ex-partner, learning of the plan, places a massive bounty on his head as the race begins.",English,"United States, India",1 win & 5 nominations,https://m.media-amazon.com/images/M/MV5BMTQ3ODY4NzYzOF5BMl5BanBnXkFtZTgwNjI3OTE4MDE@._V1_SX300.jpg,"[{'Source': 'Internet Movie Database', 'Value': '6.4/10'}, {'Source': 'Rotten Tomatoes', 'Value': '22%'}, {'Source': 'Metacritic', 'Value': '39/100'}]",39,6.4,"168,045",tt2369135,movie,05 Aug 2014,"$43,577,636",N/A,N/A,True,
76,Rio 2,2014,G,11 Apr 2014,101 min,"Animation, Adventure, Comedy",Carlos Saldanha,"Don Rhymer, Carlos Kotkin, Jenny Bicks","Jesse Eisenberg, Anne Hathaway, Jemaine Clement","It's a jungle out there for Blu, Jewel, and their three kids after they're hurtled from Rio de Janeiro to the wilds of the Amazon. As Blu tries to fit in, he goes beak-to-beak with the vengeful Nigel and meets his father-in-law.","English, Portuguese","United States, Canada",Nominated for 1 BAFTA Film Award2 wins & 24 nominations total,https://m.media-amazon.com/images/M/MV5BMTgzMDczMDYzNl5BMl5BanBnXkFtZTgwMzk2MDIwMTE@._V1_SX300.jpg,"[{'Source': 'Internet Movie Database', 'Value': '6.3/10'}, {'Source': 'Rotten Tomatoes', 'Value': '48%'}, {'Source': 'Metacritic', 'Value': '49/100'}]",49,6.3,"86,174",tt2357291,movie,15 Jul 2014,"$131,538,435",N/A,N/A,True,
77,Seventh Son,2014,PG-13,06 Feb 2015,102 min,"Action, Adventure, Fantasy",Sergei Bodrov,"Charles Leavitt, Steven Knight, Matt Greenberg","Ben Barnes, Julianne Moore, Jeff Bridges","When Mother Malkin, the queen of evil witches, escapes the pit she was imprisoned in by professional monster hunter Spook decades ago and kills his apprentice, he recruits young Tom, the seventh son of the seventh son, to help him.",English,"United States, United Kingdom, Canada, China",2 wins & 1 nomination,https://m.media-amazon.com/images/M/MV5BMjAxNTg2MDkyN15BMl5BanBnXkFtZTgwNzA3NzY1MjE@._V1_SX300.jpg,"[{'Source': 'Internet Movie Database', 'Value': '5.5/10'}, {'Source': 'Rotten Tomatoes', 'Value': '12%'}, {'Source': 'Metacritic', 'Value': '30/100'}]",30,5.5,"75,202",tt1121096,movie,26 May 2015,"$17,223,265",N/A,N/A,True,
78,Exodus: Gods and Kings,2014,PG-13,12 Dec 2014,150 min,"Action, Adventure, Drama",Ridley Scott,"Adam Cooper, Bill Collage, Jeffrey Caine","Christian Bale, Joel Edgerton, Ben Kingsley","The defiant leader Moses rises up against Egyptian Pharaoh Ramses II, setting six hundred thousand slaves on a monumental journey of escape from Egypt and its terrifying cycle of deadly plagues.",English,"United Kingdom, Spain, United States",5 nominations,https://m.media-amazon.com/images/M/MV5BMjI3MDY0NjkxNl5BMl5BanBnXkFtZTgwNTM3NTA0MzE@._V1_SX300.jpg,"[{'Source': 'Internet Movie Database', 'Value': '6.0/10'}, {'Source': 'Rotten Tomatoes', 'Value': '30%'}, {'Source': 'Metacritic', 'Value': '52/100'}]",52,6.0,"165,596",tt1528100,movie,17 Mar 2015,"$65,014,513",N/A,N/A,True,
79,A Million Ways to Die in the West,2014,R,30 May 2014,116 min,"Comedy, Western",Seth MacFarlane,"Seth MacFarlane, Alec Sulkin, Wellesley Wild","Seth MacFarlane, Charlize Theron, Liam Neeson","As a cowardly farmer begins to fall for the mysterious new woman in town, he must put his newly found courage to the test when her husband, a notorious gun-slinger, announces his arrival.","English, Navajo, Mandarin",United States,6 nominations,https://m.media-amazon.com/images/M/MV5BMTQ0NDcyNjg0MV5BMl5BanBnXkFtZTgwMzk4NTA4MTE@._V1_SX300.jpg,"[{'Source': 'Internet Movie Database', 'Value': '6.1/10'}, {'Source': 'Rotten Tomatoes', 'Value': '33%'}, {'Source': 'Metacritic', 'Value': '44/100'}]",44,6.1,"185,327",tt2557490,movie,07 Oct 2014,"$43,139,300",N/A,N/A,True,
80,Sabotage,2014,R,28 Mar 2014,109 min,"Action, Crime, Drama",David Ayer,"Skip Woods, David Ayer","Arnold Schwarzenegger, Sam Worthington, Terrence Howard",Members of an elite DEA task force find themselves being taken down one by one after they rob a drug cartel safe house.,"English, Spanish",United States,2 wins & 5 nominations,https://m.media-amazon.com/images/M/MV5BMTUxNjI4MjEyN15BMl5BanBnXkFtZTgwMDUxMDM4MDE@._V1_SX300.jpg,"[{'Source': 'Internet Movie Database', 'Value': '5.7/10'}, {'Source': 'Rotten Tomatoes', 'Value': '22%'}, {'Source': 'Metacritic', 'Value': '41/100'}]",41,5.7,"62,654",tt1742334,movie,N/A,"$10,508,518",N/A,N/A,True,
81,Paddington,2014,PG,16 Jan 2015,95 min,"Adventure, Comedy, Family",Paul King,"Paul King, Hamish McColl, Michael Bond","Hugh Bonneville, Sally Hawkins, Julie Walters","A young Peruvian bear travels to London in search of a home. Finding himself lost and alone at Paddington Station, he meets the kindly Brown family, who offer him a temporary haven.",English,"United Kingdom, France, United States, China",Nominated for 2 BAFTA Film 3 wins & 7 nominations total,https://m.media-amazon.com/images/M/MV5BMTAxOTMwOTkwNDZeQTJeQWpwZ15BbWU4MDEyMTI1NjMx._V1_SX300.jpg,"[{'Source': 'Internet Movie Database', 'Value': '7.3/10'}, {'Source': 'Rotten Tomatoes', 'Value': '97%'}, {'Source': 'Metacritic', 'Value': '77/100'}]",77,7.3,"108,685",tt1109624,movie,28 Apr 2015,"$76,271,832",N/A,N/A,True,
82,Non-Stop,2014,PG-13,28 Feb 2014,106 min,"Action, Mystery, Thriller",Jaume Collet-Serra,"John W. Richardson, Christopher Roach, Ryan Engle","Liam Neeson, Julianne Moore, Scoot McNairy","An air marshal springs into action during a transatlantic flight after receiving a series of text messages demanding $150 million into an off-shore account, or someone will die every 20 minutes.","English, German","United Kingdom, France, United States, Canada",1 nomination,https://m.media-amazon.com/images/M/MV5BOTI3NzcxMjkzMl5BMl5BanBnXkFtZTgwMDY0NTQ0MDE@._V1_SX300.jpg,"[{'Source': 'Internet Movie Database', 'Value': '6.9/10'}, {'Source': 'Rotten Tomatoes', 'Value': '62%'}, {'Source': 'Metacritic', 'Value': '56/100'}]",56,6.9,"259,599",tt2024469,movie,10 Jun 2014,"$92,168,600",N/A,N/A,True,
83,The Best of Me,2014,PG-13,17 Oct 2014,118 min,"Drama, Romance",Michael Hoffman,"Nicholas Sparks, Will Fetters, J. Mills Goodloe","James Marsden, Michelle Monaghan, Luke Bracey",A pair of former high school sweethearts reunite after many years when they return to visit their small hometown.,English,United States,N/A,https://m.media-amazon.com/images/M/MV5BMzQ5Njg3Njk5N15BMl5BanBnXkFtZTgwODIwODIxMjE@._V1_SX300.jpg,"[{'Source': 'Internet Movie Database', 'Value': '6.7/10'}, {'Source': 'Rotten Tomatoes', 'Value': '12%'}, {'Source': 'Metacritic', 'Value': '29/100'}]",29,6.7,"70,254",tt1972779,movie,03 Feb 2015,"$26,766,213",N/A,N/A,True,
84,Horrible Bosses 2,2014,R,26 Nov 2014,108 min,"Comedy, Crime",Sean Anders,"Sean Anders, John Morris, Jonathan Goldstein","Jason Bateman, Jason Sudeikis, Charlie Day","Dale, Kurt and Nick decide to start their own business but things don't go as planned because of a slick investor, prompting the trio to pull off a harebrained and misguided kidnapping scheme.","English, Spanish",United States,1 win & 6 nominations,https://m.media-amazon.com/images/M/MV5BYzFjYWVhYzYtMDZjNi00ZTc5LTk1MWQtNTBlZTA1MDFhMzY3XkEyXkFqcGdeQXVyNjQ2MjQ5NzM@._V1_SX300.jpg,"[{'Source': 'Internet Movie Database', 'Value': '6.3/10'}, {'Source': 'Rotten Tomatoes', 'Value': '35%'}, {'Source': 'Metacritic', 'Value': '40/100'}]",40,6.3,"167,153",tt2170439,movie,24 Feb 2015,"$54,445,357",N/A,N/A,True,
85,This Is Where I Leave You,2014,R,19 Sep 2014,103 min,"Comedy, Drama",Shawn Levy,Jonathan Tropper,"Jason Bateman, Tina Fey, Jane Fonda","After their father passes away, four grown siblings are forced to return to their childhood home and live under the same roof for a week, along with their over-sharing mother and an assortment of spouses, exes and might-have-beens.","English, Hebrew",United States,1 nomination,https://m.media-amazon.com/images/M/MV5BMjkzNzQ2NDMyNl5BMl5BanBnXkFtZTgwMTY3MTcxMjE@._V1_SX300.jpg,"[{'Source': 'Internet Movie Database', 'Value': '6.6/10'}, {'Source': 'Rotten Tomatoes', 'Value': '44%'}, {'Source': 'Metacritic', 'Value': '44/100'}]",44,6.6,"77,270",tt1371150,movie,16 Dec 2014,"$34,296,320",N/A,N/A,True,
86,Into the Storm,2014,PG-13,08 Aug 2014,89 min,"Action, Adventure, Drama",Steven Quale,John Swetnam,"Richard Armitage, Sarah Wayne Callies, Matt Walsh","Storm trackers, thrill-seekers, and everyday townspeople document an unprecedented onslaught of tornadoes touching down in the town of Silverton.",English,United States,2 wins & 1 nomination,https://m.media-amazon.com/images/M/MV5BMjMwODI2ODc3Nl5BMl5BanBnXkFtZTgwMDQwNjkwMjE@._V1_SX300.jpg,"[{'Source': 'Internet Movie Database', 'Value': '5.8/10'}, {'Source': 'Rotten Tomatoes', 'Value': '21%'}, {'Source': 'Metacritic', 'Value': '44/100'}]",44,5.8,"67,439",tt2106361,movie,18 Nov 2014,"$47,602,194",N/A,N/A,True,
87,Penguins of Madagascar,2014,PG,26 Nov 2014,92 min,"Animation, Adventure, Comedy","Eric Darnell, Simon J. Smith","Michael Colton, John Aboud, Brandon Sawyer","Tom McGrath, Chris Miller, Christopher Knights","Skipper, Kowalski, Rico and Private join forces with undercover organization The North Wind to stop the villainous Dr. Octavius Brine from destroying the world as we know it.","English, Italian, Mandarin, Spanish, Armenian",United States,8 nominations,https://m.media-amazon.com/images/M/MV5BMTEyMDg4MDU4MjdeQTJeQWpwZ15BbWU4MDQyOTc3MjIx._V1_SX300.jpg,"[{'Source': 'Internet Movie Database', 'Value': '6.7/10'}, {'Source': 'Rotten Tomatoes', 'Value': '73%'}, {'Source': 'Metacritic', 'Value': '53/100'}]",53,6.7,"86,590",tt1911658,movie,04 Nov 2014,"$83,850,911",N/A,N/A,True,
88,Jack Ryan: Shadow Recruit,2014,PG-13,17 Jan 2014,105 min,"Action, Drama, Thriller",Kenneth Branagh,"Adam Cozad, David Koepp, Tom Clancy","Chris Pine, Kevin Costner, Keira Knightley","Jack Ryan, as a young covert C.I.A. analyst, uncovers a Russian plot to crash the U.S. economy with a terrorist attack.","English, Russian","United States, Russia",3 nominations,https://m.media-amazon.com/images/M/MV5BMTY2MDkxNzYwNl5BMl5BanBnXkFtZTgwOTM2MjE5MDE@._V1_SX300.jpg,"[{'Source': 'Internet Movie Database', 'Value': '6.2/10'}, {'Source': 'Rotten Tomatoes', 'Value': '54%'}, {'Source': 'Metacritic', 'Value': '57/100'}]",57,6.2,"128,620",tt1205537,movie,10 Jun 2014,"$50,577,412",N/A,N/A,True,
89,Mommy,2014,R,08 Oct 2014,139 min,Drama,Xavier Dolan,Xavier Dolan,"Anne Dorval, Antoine Olivier Pilon, Suzanne Clément","A widowed single mother, raising her violent son alone, finds new hope when a mysterious neighbor inserts herself into their household.","French, English",Canada,54 wins & 66 nominations,https://m.media-amazon.com/images/M/MV5BMGI3YWFmNDQtNjc0Ny00ZDBjLThlNjYtZTc1ZTk5MzU2YTVjXkEyXkFqcGdeQXVyNzA4ODc3ODU@._V1_SX300.jpg,"[{'Source': 'Internet Movie Database', 'Value': '8.1/10'}, {'Source': 'Rotten Tomatoes', 'Value': '88%'}, {'Source': 'Metacritic', 'Value': '74/100'}]",74,8.1,"54,997",tt3612616,movie,17 Mar 2015,"$3,494,070",N/A,N/A,True,
90,Testament of Youth,2014,PG-13,16 Jan 2015,129 min,"Biography, Drama, History",James Kent,"Vera Brittain, Juliette Towhidi","Alicia Vikander, Kit Harington, Taron Egerton","A British woman recalls coming of age during World War I - a story of young love, the futility of war, and how to make sense of the darkest times.","English, German","United Kingdom, Denmark",5 wins & 7 nominations,https://m.media-amazon.com/images/M/MV5BMTAyOTI3OTgwMTdeQTJeQWpwZ15BbWU4MDAwNzM2NDUx._V1_SX300.jpg,"[{'Source': 'Internet Movie Database', 'Value': '7.3/10'}, {'Source': 'Rotten Tomatoes', 'Value': '84%'}, {'Source': 'Metacritic', 'Value': '76/100'}]",76,7.3,"28,364",tt1441953,movie,20 Oct 2015,"$1,822,250",N/A,N/A,True,
91,Cooties,2014,R,18 Sep 2015,88 min,"Action, Comedy, Horror","Jonathan Milott, Cary Murnion","Leigh Whannell, Ian Brennan, Josh C. Waller","Elijah Wood, Rainn Wilson, Alison Pill","A mysterious virus hits an isolated elementary school, transforming the kids into a feral swarm of mass savages. An unlikely hero must lead a motley band of teachers in the fight of their lives.",English,United States,1 win & 4 nominations,https://m.media-amazon.com/images/M/MV5BMTA4MTM5NzExMjBeQTJeQWpwZ15BbWU4MDYyNTk1OTUx._V1_SX300.jpg,"[{'Source': 'Internet Movie Database', 'Value': '5.7/10'}, {'Source': 'Rotten Tomatoes', 'Value': '48%'}, {'Source': 'Metacritic', 'Value': '49/100'}]",49,5.7,"25,288",tt2490326,movie,01 Dec 2015,"$60,058",N/A,N/A,True,
92,The Book of Life,2014,PG,17 Oct 2014,95 min,"Animation, Adventure, Comedy",Jorge R. Gutiérrez,"Jorge R. Gutiérrez, Doug Langdale","Diego Luna, Zoe Saldana, Channing Tatum","Manolo, a young man who is torn between fulfilling the expectations of his family and following his heart, embarks on an adventure that spans three fantastic worlds where he must face his greatest fears.","English, Spanish",United States,3 wins & 29 nominations,https://m.media-amazon.com/images/M/MV5BMTkzOTgzNDYzOF5BMl5BanBnXkFtZTgwOTgxMTkyMjE@._V1_SX300.jpg,"[{'Source': 'Internet Movie Database', 'Value': '7.3/10'}, {'Source': 'Rotten Tomatoes', 'Value': '83%'}, {'Source': 'Metacritic', 'Value': '67/100'}]",67,7.3,"68,972",tt2262227,movie,27 Jan 2015,"$50,151,543",N/A,N/A,True,
93,Goodnight Mommy,2014,R,11 Sep 2015,99 min,"Horror, Mystery, Thriller","Severin Fiala, Veronika Franz","Veronika Franz, Severin Fiala","Lukas Schwarz, Elias Schwarz, Susanne Wuest","Twin boys move to a new house with their mother after she has face-changing cosmetic surgery, but under the bandages is someone the boys don't recognize.",German,Austria,23 wins & 36 nominations,https://m.media-amazon.com/images/M/MV5BMjAyMDU2NjU4OF5BMl5BanBnXkFtZTgwNDg5ODc0NjE@._V1_SX300.jpg,"[{'Source': 'Internet Movie Database', 'Value': '6.7/10'}, {'Source': 'Rotten Tomatoes', 'Value': '85%'}, {'Source': 'Metacritic', 'Value': '81/100'}]",81,6.7,"49,461",tt3086442,movie,15 Dec 2015,"$1,178,196",N/A,N/A,True,
94,The November Man,2014,R,27 Aug 2014,108 min,"Action, Thriller",Roger Donaldson,"Michael Finch, Karl Gajdusek, Bill Granger","Pierce Brosnan, Luke Bracey, Olga Kurylenko",An ex-C.I.A. operative is brought back in on a very personal mission and finds himself pitted against his former pupil in a deadly game involving high level C.I.A. officials and the Russian President-elect.,"English, Russian","United States, United Kingdom",N/A,https://m.media-amazon.com/images/M/MV5BNTkzMDk5NjUxNV5BMl5BanBnXkFtZTgwMzMwOTMyMjE@._V1_SX300.jpg,"[{'Source': 'Internet Movie Database', 'Value': '6.3/10'}, {'Source': 'Rotten Tomatoes', 'Value': '36%'}, {'Source': 'Metacritic', 'Value': '38/100'}]",38,6.3,"66,904",tt2402157,movie,25 Nov 2014,"$25,018,119",N/A,N/A,True,
95,Dracula Untold,2014,PG-13,10 Oct 2014,92 min,"Action, Drama, Fantasy",Gary Shore,"Matt Sazama, Burk Sharpless, Bram Stoker","Luke Evans, Dominic Cooper, Sarah Gadon","As his kingdom is being threatened by the Turks, young prince Vlad Tepes must become a monster feared by his own people in order to obtain the power needed to protect his own family, and the families of his kingdom.","English, Turkish",United States,3 wins & 5 nominations,https://m.media-amazon.com/images/M/MV5BMTkzNzI1OTI4N15BMl5BanBnXkFtZTgwNTQ2NzEwMjE@._V1_SX300.jpg,"[{'Source': 'Internet Movie Database', 'Value': '6.3/10'}, {'Source': 'Rotten Tomatoes', 'Value': '25%'}, {'Source': 'Metacritic', 'Value': '40/100'}]",40,6.3,"189,162",tt0829150,movie,03 Feb 2015,"$56,280,355",N/A,N/A,True,
96,Unfriended,2014,R,17 Apr 2015,83 min,"Horror, Mystery, Thriller",Levan Gabriadze,Nelson Greaves,"Heather Sossaman, Matthew Bohrer, Courtney Halverson","A group of online chatroom friends find themselves haunted by a mysterious, supernatural force using the account of their dead friend.",English,"United States, Russia",3 wins & 6 nominations,https://m.media-amazon.com/images/M/MV5BMzdlNWI2MjYtMWY3ZC00N2EzLWIzNTgtZDY2NGI4OTY3Yzc5XkEyXkFqcGdeQXVyMjQwMjk0NjI@._V1_SX300.jpg,"[{'Source': 'Internet Movie Database', 'Value': '5.5/10'}, {'Source': 'Rotten Tomatoes', 'Value': '62%'}, {'Source': 'Metacritic', 'Value': '59/100'}]",59,5.5,"73,294",tt3713166,movie,11 Aug 2015,"$32,482,090",N/A,N/A,True,
97,I Origins,2014,R,18 Jul 2014,106 min,"Drama, Mystery, Romance",Mike Cahill,Mike Cahill,"Michael Pitt, Steven Yeun, Astrid Bergès-Frisbey",A molecular biologist and his laboratory partner uncover evidence that may fundamentally change society as we know it.,"English, Hindi",United States,2 wins & 3 nominations,https://m.media-amazon.com/images/M/MV5BMTQ0MTAwMDI1OF5BMl5BanBnXkFtZTgwNjUwMTA2MTE@._V1_SX300.jpg,"[{'Source': 'Internet Movie Database', 'Value': '7.4/10'}, {'Source': 'Rotten Tomatoes', 'Value': '52%'}, {'Source': 'Metacritic', 'Value': '57/100'}]",57,7.4,"121,988",tt2884206,movie,09 Dec 2014,"$336,472",N/A,N/A,True,
98,Transcendence,2014,PG-13,18 Apr 2014,119 min,"Action, Drama, Sci-Fi",Wally Pfister,Jack Paglen,"Johnny Depp, Rebecca Hall, Morgan Freeman",A scientist's drive for artificial intelligence takes on dangerous implications when his own consciousness is uploaded into one such program.,English,"United Kingdom, China, United States",3 wins & 5 nominations,https://m.media-amazon.com/images/M/MV5BMTc1MjQ3ODAyOV5BMl5BanBnXkFtZTgwNjI1NDQ0MTE@._V1_SX300.jpg,"[{'Source': 'Internet Movie Database', 'Value': '6.2/10'}, {'Source': 'Rotten Tomatoes', 'Value': '19%'}, {'Source': 'Metacritic', 'Value': '42/100'}]",42,6.2,"224,216",tt2209764,movie,22 Jul 2014,"$23,022,309",N/A,N/A,True,
99,Endless Love,2014,PG-13,14 Feb 2014,104 min,"Drama, Romance",Shana Feste,"Shana Feste, Joshua Safran, Scott Spencer","Gabriella Wilde, Alex Pettyfer, Bruce Greenwood",The story of a privileged girl and a charismatic boy whose instant desire sparks a love affair made only more reckless by parents trying to keep them apart.,English,United States,1 win,https://m.media-amazon.com/images/M/MV5BOTYzNDU1MzEyN15BMl5BanBnXkFtZTgwOTYwMTU0MDE@._V1_SX300.jpg,"[{'Source': 'Internet Movie Database', 'Value': '6.3/10'}, {'Source': 'Rotten Tomatoes', 'Value': '16%'}, {'Source': 'Metacritic', 'Value': '30/100'}]",30,6.3,"43,278",tt2318092,movie,15 Apr 2014,"$23,438,250",N/A,N/A,True,
100,Just Before I Go,2014,R,24 Apr 2015,95 min,"Comedy, Drama",Courteney Cox,David Flebotte,"Seann William Scott, Olivia Thirlby, Garret Dillahunt","On the verge of giving up on life, a guy travels to his hometown to make amends.",English,United States,N/A,https://m.media-amazon.com/images/M/MV5BNTE5MDA0NTk4MV5BMl5BanBnXkFtZTgwNTY1MDUyNTE@._V1_SX300.jpg,"[{'Source': 'Internet Movie Database', 'Value': '6.4/10'}, {'Source': 'Rotten Tomatoes', 'Value': '9%'}, {'Source': 'Metacritic', 'Value': '24/100'}]",24,6.4,"18,624",tt2980472,movie,12 May 2015,"$10,970",N/A,N/A,True,
101,Before I Go to Sleep,2014,R,31 Oct 2014,92 min,"Drama, Mystery, Thriller",Rowan Joffe,"Rowan Joffe, S.J. Watson","Nicole Kidman, Colin Firth, Mark Strong","A woman wakes up every day, remembering nothing as a result of a traumatic accident in her past. One day, new terrifying truths emerge that force her to question everyone around her.",English,"United Kingdom, United States, France, Sweden",N/A,https://m.media-amazon.com/images/M/MV5BNjI0NTAwMTU1NV5BMl5BanBnXkFtZTgwNzkwNjQ0MjE@._V1_SX300.jpg,"[{'Source': 'Internet Movie Database', 'Value': '6.4/10'}, {'Source': 'Rotten Tomatoes', 'Value': '37%'}, {'Source': 'Metacritic', 'Value': '41/100'}]",41,6.4,"76,878",tt1726592,movie,27 Jan 2015,"$3,242,457",N/A,N/A,True,
102,The Good Lie,2014,PG-13,07 Nov 2014,110 min,"Biography, Drama",Philippe Falardeau,Margaret Nagle,"Reese Witherspoon, Arnold Oceng, Ger Duany","A group of Sudanese refugees, given the chance to resettle in the U.S., arrive in Kansas City, Missouri, where their encounter with an employment agency counselor forever changes all of their lives.",English,"Kenya, India, United States, Canada, South Africa",3 wins & 7 nominations,https://m.media-amazon.com/images/M/MV5BMjA0Njc1MzA4MF5BMl5BanBnXkFtZTgwODc1MjUwMjE@._V1_SX300.jpg,"[{'Source': 'Internet Movie Database', 'Value': '7.4/10'}, {'Source': 'Rotten Tomatoes', 'Value': '87%'}, {'Source': 'Metacritic', 'Value': '65/100'}]",65,7.4,"28,287",tt2652092,movie,23 Dec 2014,"$2,722,209",N/A,N/A,True,
103,Deliver Us from Evil,2014,R,02 Jul 2014,118 min,"Crime, Drama, Fantasy",Scott Derrickson,"Scott Derrickson, Paul Harris Boardman, Ralph Sarchie","Eric Bana, Edgar Ramírez, Olivia Munn","New York police officer Ralph Sarchie investigates a series of crimes. He joins forces with an unconventional priest, schooled in the rites of exorcism, to combat the possessions that are terrorizing their city.","English, Spanish, Latin, Italian",United States,2 wins & 4 nominations,https://m.media-amazon.com/images/M/MV5BM2MwYjg5NDEtYmZiNy00YTk4LWIwMmItMGE3MmM2YzY4MmYzXkEyXkFqcGdeQXVyNTIzOTk5ODM@._V1_SX300.jpg,"[{'Source': 'Internet Movie Database', 'Value': '6.2/10'}, {'Source': 'Rotten Tomatoes', 'Value': '29%'}, {'Source': 'Metacritic', 'Value': '40/100'}]",40,6.2,"75,312",tt2377322,movie,21 Oct 2014,"$30,577,122",N/A,N/A,True,
